城市,标题,房源信息描述,房源位置信息,单价,房总款
天津,鲲贝园1居室空间大低楼层主卧客厅朝南看房有钥匙,1室2厅|74O|中层（共18层）|南北向|2014年建|杨继金,鲲贝园中新生态城-开发区和惠路与和畅路交口东北侧,10270元/O,76万
天津,3室2厅 南北 精装修 4,3室2厅|114O|中层（共28层）|南北向|2020年建|杨继金,贻成学府壹号中新生态城-中新生态城中部核心区华一路与中天大道交口,16315元/O,186万
天津,南北通透富力津门湖嘉郡花园2室1厅精装修,2室1厅|88.11O|中层（共26层）|南北向|2006年建|沈剑飞,富力津门湖嘉郡花园李七庄-天津市西青区江湾路东100米,23266元/O,205万
天津,秀丽园南北通透三室诚意出售价格可谈,3室1厅|113.37O|高层（共6层）|南北向|2017年建|王倩,秀丽园鲁山道-河东区区祁连路与卫国道交口,14554元/O,165万
天津,急售富力桃园 楼霸 超级无敌视野 南北通透 4室2厅 精装修,4室2厅|173.81O|顶层（共28层）|南北向|2010年建|姬雪军,富力桃园双港镇-天津市津南区赤龙街与微山路交口西南角,15246元/O,265万
天津,吉利花园商品房.找我能便宜.至臻好房.着急用钱,2室1厅|97.76O|中层（共32层）|东南向|2006年建|高尚,吉利花园南营门-贵阳路13号,55748元/O,545万
天津,橙翠园 南北通透 一楼有小院 满五年 交通便利 格局好,3室2厅|129.65O|低层（共9层）|南北向|2017年建|王倩,太阳城橙翠园鲁山道-鲁山道与凤山道交口西北角,25067元/O,325万
天津,天房美域豪庭 90.33平2居 南北向简装修 方便看房,2室2厅|90.33O|中层（共26层）|南北向|2012年建|陈红,天房美域豪庭李七庄-天津市西青区昌凌路与集美道交口东北角,17270元/O,156万
天津,南北通透海逸长洲恋海园3室2厅,3室2厅|159.97O|高层（共24层）|南北向|2006年建|李晟昊,海逸长洲恋海园李七庄-友谊南路与绥江道交口西南侧,32193元/O,515万
天津,富力津门湖观鹭花园 4室2厅 精装修,4室2厅|184.18O|低层（共24层）|东南向|2007年建|张琳,富力津门湖观鹭花园李七庄-江湾路与绥江道交口东北侧500米,31219元/O,575万
天津,南北通透 宝龙城北苑 3室2厅 精装修,3室2厅|129O|低层（共18层）|南北向|2017年建|朱明霞,宝龙城北苑中新生态城-滨海旅游区海旭道与安明路交口,13565元/O,175万
天津,积庆里拆间直管公集体可买有钥匙随时看价位有商量,1室0厅|14.31O|高层（共6层）|东向|2018年建|胡懿玲,积庆里大营门-河西区绍兴道与九龙路交口,82459元/O,118万
天津,新梅江雅境花语城 130.53平3居 南北向精装修 拎包入住,3室2厅|130.53O|低层（共28层）|南北向|2015年建|陈红,新梅江雅境花语城梅江-解放南路与浯水道交口东北侧,29035元/O,379万
天津,红|领世郡常春藤 109.44平2居 南北向精装修 着急出售,2室2厅|109.44O|高层（共5层）|南北向|2007年建|陈红,红|领世郡常春藤双港镇-解放南路与外环线交口以东两公里,16904元/O,185万
天津,南北通透境界梅江逸涛园3室2厅精装修,3室2厅|144.39O|中层（共18层）|南北向|2008年建|刘欢欢,境界梅江逸涛园李七庄-天津市西青区外环线与梅江西路交口处东北角,29157元/O,421万
天津,新上 天华里 齐门双阳居 南北通透 户型规整没浪费面积,2室1厅|77.58O|高层（共6层）|南北向|2017年建|郑旭坤,天华里华苑-天津市南开区华苑雅士道与华苑路交口西侧,28100元/O,218万
天津,南北通透万科水晶城皓石园2室1厅精装修,2室1厅|103.66O|中层（共8层）|南北向|2000年建|孙艳艳,万科水晶城皓石园梅江-解放南路518号,28169元/O,292万
天津,正南 海逸长洲瀚景园 1室1厅 精装修,1室1厅|69.89O|低层（共28层）|南向|2007年建|张琳,海逸长洲瀚景园梅江-友谊南路与绥江道交口西侧,31478元/O,220万
天津,满五年!上海道学!出小区地铁站,1室1厅|42.73O|中层（共7层）|南北向|2017年建|马伟丛,向荣里马场街-河西区宾友道与文静路交口西侧,50549元/O,216万
天津,"宝庆里 南北通透,采光充足,配套设施齐全,交通便利",2室1厅|63.04O|高层（共6层）|南北向|2018年建|张岩,宝庆里张家窝-张家窝镇董庄子村吉庆道旁,9200元/O,58万
天津,海逸长洲恋海园4室2厅,4室2厅|183.49O|中层（共26层）|北向|2010年建|刘金刚,海逸长洲恋海园李七庄-友谊南路与绥江道交口西南侧,31554元/O,579万
天津,优质房源 有燃 诚意出售,1室1厅|64.14O|底层（共24层）|西南向|2017年建|张毅秀,保利金香槟(商住楼)南市-和平路,32429元/O,208万
天津,南北通透雅都天元居2室2厅,2室2厅|110O|底层（共12层）|南北向|2003年建|王亮,雅都天元居第二大街-广达街与巢湖路交口,18363元/O,202万
天津,地下与滨海高铁站互连 精装大阳台落地窗 耀华岳阳道 团购续客,3室2厅|130O|低层（共28层）|南北向|2022年建|李明,金融街・滨海融御于家堡-新金融大道(滨海站东100米),17230元/O,224万
城市,标题,房源信息描述,房源位置信息,单价,房总款
天津,南北通透香水园2室1厅,2室1厅|92.1O|低层（共26层）|南北向|2007年建|胡绍臣,香水园梅江-九华山路90号,33550元/O,309万
天津,新梅江雅境新枫尚 93.24平2居 南北向精装修 视野无遮挡,2室2厅|93.24O|底层（共27层）|南北向|2015年建|陈红,新梅江雅境新枫尚梅江-解放南路与渌水道交口东南侧,28421元/O,265万
天津,南北通透 中梁石榴滨海湾 3室1厅,3室1厅|91.76O|低层（共32层）|南北向|李明,中梁石榴滨海湾于家堡-洞庭路与上海道交汇处万达广场南侧,18962元/O,174万
天津,"河西电梯次新房,电梯洋房,满五,台湾路复兴,采光好",4室2厅|144.29O|高层（共10层）|南北向|2018年建|张飞,中海复兴九里陈塘庄-黑牛城道与洞庭路交口,41582元/O,600万
天津,"通透户型,精装,采光充足,视野宽阔,交通便利",3室2厅|105.4O|中层（共18层）|南北向|2018年建|刘晓明,宝龙城中新生态城-滨海旅游区海旭道与安明路交口,13567元/O,143万
天津,中.介.费共①个点 海河畔 电梯洋房 H户型 业主诚意卖,2室1厅|110.05O|中层（共10层）|南北向|2017年建|薛维,海景公寓挂甲寺-河西区小围堤道与南北大街交口东侧,42707元/O,470万
天津,保利云禧 3室2厅2卫 精装修 510万元,3室2厅|106.25O|低层（共6层）|南北向|2023年建|杨涛,保利云禧王顶堤-迎水道99号,48000元/O,510万
天津,和平二片 新星小W 产权清晰 面积足 总价低 诚心出售,1室0厅|22.14O|顶层（共4层）|南北向|于万丽,五爱里南营门-和平区万全道与兰州道交口,65492元/O,145万
天津,泰达园 二楼 精装三室 诚意出售,3室2厅|120.25O|底层（共6层）|南北向|2018年建|边高峰,泰达园桃园街-永安道12号,49896元/O,600万
天津,"精装修 配套齐全 生活便利,南北通透户型",3室2厅|94.15O|中层（共18层）|南北向|2017年建|刘晓明,碧桂园滨海城中新生态城-天津市中新生态城中央大道与海博路交口,13807元/O,130万
天津,南北通透 景观花园 3室2厅 精装修 随时看房 房主诚意出售,3室2厅|158.11O|高层（共18层）|南北向|2023年建|王淑贤,景观花园梅江-梅江道18号,27196元/O,430万
天津,太极园 南开中芯 中芥1% 带电梯 单价低 价格可谈,2室1厅|129.08O|中层（共25层）|东南向|2006年建|沈广升,"太极园兴南街-南开三马路与南京路交口,今晚报大厦后身",23628元/O,305万
天津,无锡道大楼 二拆一 直管公产 118万 面积大 价格低,1室0厅|25.58O|高层（共6层）|南向|2017年建|王健,无锡道大楼大营门-河西区南昌路与浦口道交口,46129元/O,118万
天津,"此房南北通透,精装修,中间楼层,视野采光好",2室2厅|90.27O|中层（共34层）|南北向|2017年建|冯超,万科海港城东疆港-开发区时尚广场区域万科金域蓝湾以东,15509元/O,140万
天津,南北通透全运村云实园3室2厅精装修,3室2厅|120O|高层（共23层）|南北向|2015年建|孙艳艳,全运村云实园东海街-洞庭路与渌水道交口,40000元/O,480万
天津,【亲民存房拥金1】 三楼私产 可贷款 房主诚心卖 不临街不把,2室1厅|58.56O|中层（共6层）|南北向|2017年建|姜旭,照湖里学府街-湖镜道1号,25614元/O,150万
天津,南北通透水岸公馆天涛园3室2厅,3室2厅|187O|低层（共29层）|南北向|2007年建|王路路,水岸公馆天涛园梅江-天津市西青区环岛西路与浯水道交口西南角,26684元/O,499万
天津,天新北里 null 简装,1室1厅|34.03O|中层（共7层）|东西向|张寰,天新北里南营门-新欣里5-501号,60240元/O,205万
天津,南北通透 中心北路 3室1厅,3室1厅|81O|底层（共6层）|南北向|1998年建|李明,中心北路杭州道-杭州道与中心北路交口,12345元/O,100万
天津,起步区别墅新加推330万左右带2个车位有看的联系,4室3厅|169O|顶层（共3层）|南北向|2017年建|董振林,澜岸铭苑中新生态城-生态城起步区,19526元/O,330万
天津,正南富力津门湖清溪花园2室2厅精装修,2室2厅|99.78O|低层（共21层）|南向|2008年建|沈剑飞,富力津门湖清溪花园李七庄-河西紫金山路与珠江道交口西侧,30066元/O,300万
天津,中介M1%云锦世家 三期洋房 楼层好 急售 性价比高,3室1厅|119.84O|高层（共9层）|南北向|2017年建|包冰洁,锦世家中北镇-星光路西侧,19192元/O,230万
天津,南北通透天保天成铂悦4室2厅,4室2厅|143O|中层（共22层）|南北向|2020年建|王亮,天保天成铂悦第二大街-太湖西路与第一大街交口,18881元/O,270万
天津,富力津门湖澄澜花园 全新豪装 349万 门口公园 新小区合适,3室2厅|155.31O|高层（共32层）|南向|2018年建|赵江海,富力津门湖澄澜花园李七庄-紫金山路与珠江道交口西侧,22471元/O,349万
天津,秀丽园南北通透三室诚意出售价格可谈,3室1厅|113.37O|高层（共6层）|南北向|2017年建|王倩,秀丽园鲁山道-河东区区祁连路与卫国道交口,14554元/O,165万
天津,南北通透 双港新家园欣悦佳园 2室1厅,2室1厅|74.72O|低层（共17层）|南北向|2010年建|张睿征,双港新家园欣悦佳园双港镇-双港镇景茗道与领世路交口东侧,13383元/O,100万
天津,二片全明户型2居 私产 有座位 随时看房,2室1厅|63.09O|中层（共7层）|南北向|2018年建|张寰,万全里南营门-万全道154号天赐园,57061元/O,360万
天津,南北通透 城投华润天津瑞府 3室2厅,3室2厅|140.58O|高层（共33层）|南北向|2021年建|刘金刚,城投华润天津瑞府梅江-洞庭路与太湖路交口,36633元/O,515万
天津,"采光充足,居住舒适,适合改善的,普通装修",1室1厅|23.55O|高层（共6层）|东向|2018年建|曲强,河沿里新兴街-吴家窑大街与气象台路交口新兴医院旁,112526元/O,265万
天津,内部价 免290W起河西三片师大二免中jie费倒找钱返用金,2室2厅|82O|底层（共6层）|南向|2006年建|吴磊,中海左岸源境东海街-枫林路与泗水道交口,34146元/O,280万
天津,中.介.费共①个点 裕阳花园 2室 H户型 电梯洋房,2室1厅|99.82O|中层（共7层）|南北向|2006年建|王宏莉,裕阳花园春华街-新兆路与华捷道交口,24944元/O,249万
天津,洋房社区 全运村月橘园 精装修 保持特别好 房主着急出售,3室2厅|139.14O|中层（共9层）|南北向|2018年建|张丽娜,全运村月橘园东海街-洞庭路与渌水道交口,44200元/O,615万
天津,南北通透 富力津门湖观鹭花园 3室2厅 精装修,3室2厅|163.75O|顶层（共28层）|南北向|2007年建|张琳,富力津门湖观鹭花园李七庄-江湾路与绥江道交口东北侧500米,27480元/O,450万
天津,二楼H户型大两室 一梯两户不临街 有两个固定车位,2室2厅|120.99O|低层（共6层）|南北向|2017年建|王伟,水竹花园西沽-湘潭道38号,22233元/O,269万
天津,"安华里 2室1厅 68.35平 可以再谈,欢迎看房,随时恭",2室1厅|68.35O|高层（共6层）|南北向|2006年建|侯宝兴,安华里华苑-华苑路与宾水西道交口西侧,30431元/O,208万
天津,滨水西 现房洋房 即住 团购优惠,3室2厅|143O|中层（共24层）|南北向|2023年建|王开广,美的旭辉翰悦府张家窝-宾水西道与学府东路交口,22377元/O,320万
天津,天津新房首付二成 无其他费用 建投誉山院已于8月25日加推2,4室1厅|98O|底层（共1层）|南向|2018年建|朱光,建投・誉山院黄河道-黄河道与文水路交口,40816元/O,400万
天津,迎春里 和平3片 西康路 位置好 3个位置步行就到 可以L,2室1厅|55.23O|中层（共6层）|南向|1984年建|王子龙,和平区迎春里新兴街-西康道与宜昌路交口,39833元/O,220万
天津,南北通透海逸长洲恋海园4室2厅,4室2厅|199.86O|高层（共27层）|南北向|2006年建|高彬,海逸长洲恋海园李七庄-友谊南路与绥江道交口西南侧,27769元/O,555万
天津,中介M1% 凯立天香家园 南北通透三室 双卫 带车位,3室2厅|135O|中层（共6层）|南北向|2006年建|韩文香,凯立天香家园广开街-长江道66号(长江道与青年路交口),39703元/O,536万
天津,生态城 滨海小外旁 二次装修 临近轻轨Z4 随时看房 着急卖,2室2厅|101O|低层（共15层）|南北向|2012年建|李猛军,美林园中新生态城-美林园,13663元/O,138万
天津,吉利花园商品房.找我能便宜.至臻好房.着急用钱,2室1厅|97.76O|中层（共32层）|东南向|2006年建|高尚,吉利花园南营门-贵阳路13号,55748元/O,545万
天津,南北通透 中梁石榴滨海湾 3室1厅,3室1厅|107.57O|中层（共25层）|南北向|李明,中梁石榴滨海湾于家堡-洞庭路与上海道交汇处万达广场南侧,18592元/O,200万
天津,急!急!急南北仁恒公园世纪 房主急售 看房随时 千万别,2室2厅|96.29O|低层（共26层）|南北向|2021年建|张丽娜,仁恒公园世纪梅江-浯水道与洞庭路交口,39256元/O,378万
天津,浦口道小区 闽侯路 南北通透 满两年 随时可看,2室1厅|59.65O|中层（共6层）|南北向|2017年建|李勇,"浦口道小区桃园街-河西区浦口道,西至九龙路交口,西至台儿庄路",42414元/O,253万
天津,鲲贝园3居室观景楼层环境优美统一装修居住舒适,3室2厅|145O|高层（共21层）|南北向|2010年建|杨继金,鲲贝园中新生态城-开发区和惠路与和畅路交口东北侧,10344元/O,150万
天津,南北通透B林2室2厅,2室2厅|98O|低层（共24层）|南北向|2015年建|王亮,B林第四大街-开发区南海路以东泰达大街以北,13775元/O,135万
天津,南北通透城投华润天津瑞府2室2厅,2室2厅|105O|高层（共31层）|南北向|2013年建|刘金刚,城投华润天津瑞府梅江-洞庭路与太湖路交口,36666元/O,385万
天津,金泉里 公产一室 高楼层 视野采光好 诚意出售,1室1厅|23.65O|顶层（共6层）|南向|2018年建|曲强,金泉里新兴街-吴家窑一号路与河沿道交叉路口向东北约100米,141649元/O,335万
天津,"业主急售!没有遮挡,自带精装,价格合适",2室1厅|81.48O|高层（共18层）|南向|2018年建|马立栋,万科四季花城张家窝-京福支线与辛老路交口南侧,13500元/O,110万
天津,鹏飞南开学苑 黄河道新项目 洋房 南开中W 中营 9年一惯制,3室2厅|111.78O|中层（共7层）|南北向|2020年建|王健,南开1911向阳路-黄河道与红日路交口启迪协信营销中心,48309元/O,540万
天津,"海教园锦绣大家,三室朝阳好房诚意出售",3室2厅|109.47O|底层（共9层）|南向|2017年建|李明文,锦绣大家海河教育园-海河教育园区和慧南路与同心路交口东南侧,16625元/O,182万
天津,3楼 私产可贷款 房主诚心卖 南北向,2室1厅|53.22O|中层（共6层）|南北向|2010年建|曹承刚,丁字沽十三段丁字沽-丁字沽一号路与咸阳北路交口,12777元/O,68万
天津,中海御湖翰苑人车分流 好位置 中.介.费1%,3室2厅|136.48O|高层（共32层）|南北向|2006年建|汪波涛,中海御湖翰苑王顶堤-红旗南路与宾水西道交口,29161元/O,398万
天津,急!急!急碧海白天鹅 南北简装修多层 165.55平 急售,2室2厅|165.55O|底层（共1层）|南北向|2018年建|张飞,碧海白天鹅陈塘庄-大沽南路987号,19329元/O,320万
天津,南北通透 万科新梅江柏翠园 3室2厅 精装修,3室2厅|156.45O|底层（共11层）|南北向|2016年建|王路路,万科新梅江柏翠园梅江-太湖路解放南路新梅江太湖路公园与卫津河公园旁,45509元/O,712万
天津,"馨达园 2室2厅 115.5平 H户型南北通透,送30万精装",2室2厅|115.5O|低层（共7层）|南北向|2006年建|王鸿,馨达园学府街-白堤路200-212号,32467元/O,375万
天津,新城樾府下叠 142.19平4居 南北向简装修 拎包入住,4室2厅|142.19O|底层（共4层）|南北向|2020年建|任双双,新城樾府中新生态城-中生大道与静湖南路交口。,20887元/O,297万
天津,拥津1c 五马路 中间层通透H户型 采光好 小区规范整洁,2室2厅|107.22O|中层（共6层）|南北向|2002年建|王鸿,广泰园广开街-广开大街52号,36373元/O,390万
天津,万通开发 品质小区 万科物业 人车分流 诚意出售,2室2厅|92.97O|中层（共18层）|南北向|2018年建|程龙凯,万通生态城新新家园中新生态城-万通生态城新新家园,15596元/O,145万
城市,标题,房源信息描述,房源位置信息,单价,房总款
天津,正南 双港新家园欣悦佳园 1室1厅,1室1厅|54.79O|高层（共18层）|南向|2009年建|张娜,双港新家园欣悦佳园双港镇-双港镇景茗道与领世路交口东侧,9490元/O,52万
天津,南北通透 富力津门湖橘墅花园 4室2厅 精装修,4室2厅|277.19O|高层（共32层）|南北向|2022年建|张琳,富力津门湖橘墅花园李七庄-紫金山路与珠江道交口西侧,23810元/O,660万
天津,"地铁高铁双轨道交通,片区内的洋房住宅,一层出入方便",3室2厅|106.25O|顶层（共7层）|南北向|2017年建|马立栋,津门正荣府张家窝-南站西侧瑞雪路与嘉泰道交汇处,15529元/O,165万
天津,全阳一室 户型方正 总房款少 满足您的需要 看房方便,1室1厅|49.57O|高层（共24层）|南向|2018年建|李魁,海阔苑北塘-天津市滨海新区天池路海阔苑,7665元/O,38万
天津,"香薇邸边户大院,奢华装修进口品牌,品质顶峰",联排|卧室：5个|无花园|342.47O|南向|李明文,华润中央公园别墅双港镇-微山南路与景茗道交汇处,33579元/O,1150万
天津,"保利拾光年新房,做好了地暖,可以直接装修,不限套数",3室2厅|87.25O|中层（共16层）|南北向|2018年建|马立栋,保利拾光年张家窝-海泰大道与华科五路交口处,17191元/O,150万
天津,南北通透 中海天空之镜 3室2厅,3室2厅|169.48O|低层（共17层）|南北向|2023年建|达格拉加,中海天空之镜梅江-太湖路与梦湖西道交口,44784元/O,759万
天津,星美御次新房西康路小W阳面两室私产满五采光好环境优美采光好,2室1厅|93.38O|高层（共32层）|南向|2012年建|蒋佳伦,和康名邸新兴街-汉阳道52号,56757元/O,530万
天津,天大新园村 1室1厅1卫 普通装修 130万元,1室1厅|51.89O|顶层（共6层）|南向|2017年建|姜旭,天大新园村学府街-花堤路与铭德道交口,25053元/O,130万
天津,新城中梁长风雅筑 准现房 和平分校 格,2室2厅|86O|低层（共11层）|南北向|2018年建|石嘉庆,新城中梁长风雅著空港经济区-空港经济区东七道与航宇路交口,16511元/O,142万
天津,(新)新梅江 准现房 中海开发 配套完善,3室2厅|89.48O|中层（共26层）|南北向|2023年建|王健,中海左岸源境东海街-枫林路与泗水道交口,35762元/O,320万
天津,天赐园.新星片.南北向 .06年房龄.一梯两户.找我能便宜.,2室2厅|118.81O|中层（共20层）|南北向|2006年建|高尚,和平区天赐园南营门-新兴路与卫津路交口东侧,50500元/O,600万
天津,南北通透云水园6室2厅精装修,6室2厅|226.68O|中层（共6层）|南北向|2004年建|孙艳艳,云水园梅江-友谊南路与潭江道交口,29115元/O,660万
天津,中心商务区万科滨江都会 76平2居 南北向精装修 视野无遮挡,2室1厅|76O|中层（共17层）|南北向|2017年建|李魁,万科滨江都会响螺湾-迎宾大道与坨场道交口南100米,11578元/O,88万
天津,"凯立花园,低楼层大两室,东南北,采光好",2室2厅|97.65O|低层（共6层）|东向|2017年建|韩建强,凯立花园万兴街-万德庄大街148号,33794元/O,330万
天津,南北通透朗月轩2室2厅,2室2厅|90O|顶层（共32层）|南北向|2010年建|张嘀,朗月轩第三大街-第三大街与轻轨交口处,12111元/O,109万
天津,南北通透万科金色雅筑2室2厅精装修,2室2厅|88.18O|中层（共16层）|南北向|2009年建|李盼盼,万科金色雅筑万新街-雅筑北苑25号,15649元/O,138万
天津,川南里 满五 总价低 可贷款 诚心出售 价位可议 拥金1,1室1厅|41.56O|高层（共6层）|南向|2006年建|李,川南里嘉陵道-雅安道与云阳道交口西侧,19008元/O,79万
天津,和平二片 新星小W 产权清晰 面积足 总价低 诚心出售,1室0厅|22.14O|顶层（共4层）|南北向|于万丽,五爱里南营门-和平区万全道与兰州道交口,65492元/O,145万
天津,"精装修,中楼层,出行方便,居住舒适",2室1厅|38.57O|中层（共5层）|南北向|2018年建|贾东亮,育文里友谊路-河西区宾馆西路与西园道交口,37593元/O,145万
天津,金旭园 精装修三室电梯洋房 中间楼层采光充足价格可谈,3室2厅|142.04O|低层（共7层）|南北向|2017年建|王倩,太阳城金旭园鲁山道-河东区鲁山道与贺兰路交口,25696元/O,365万
天津,河西闽侯路 直管公产 有钥匙随时看房 诚心出售,1室0厅|22.93O|顶层（共5层）|北向|2018年建|胡懿玲,安辛庄大营门-浦口道22号,47972元/O,110万
天津,"坐北朝南,视野宽阔采光好配套好交通好",1室0厅|21.79O|中层（共5层）|南向|2018年建|赵仲华,集园里向阳路-芥园西道与冶金路交口,24323元/O,53万
天津,凤栖梧桐 110.37平3居 南北向精装修 拎包入住,3室2厅|110.37O|顶层（共25层）|南北向|2020年建|杨继金,凤栖梧桐中新生态城-生态城华三路与新一街交口,16308元/O,180万
天津,"貌川里,低楼层两室,阳面,私产满5,税费低 便宜二楼 拥金1",2室1厅|60.17O|低层（共7层）|南向|2006年建|李,川府新村貌川里嘉陵道-南开区自贡道与温江路交口,21439元/O,129万
天津,昆明路两室 私产可贷款 看房方便,2室1厅|64.8O|高层（共6层）|南向|2018年建|曲强,金泉里新兴街-吴家窑一号路与河沿道交叉路口向东北约100米,64043元/O,415万
天津,急!急!急碧海白天鹅 南北简装修多层 165.55平 急售,2室2厅|165.55O|底层（共1层）|南北向|2018年建|张飞,碧海白天鹅陈塘庄-大沽南路987号,19329元/O,320万
天津,南北通透城投华润天津瑞府2室2厅,2室2厅|105O|高层（共31层）|南北向|2013年建|刘金刚,城投华润天津瑞府梅江-洞庭路与太湖路交口,36666元/O,385万
天津,中介M1% 凯立天香家园 南北通透三室 双卫 带车位,3室2厅|135O|中层（共6层）|南北向|2006年建|韩文香,凯立天香家园广开街-长江道66号(长江道与青年路交口),39703元/O,536万
天津,生态城 起步区万达旁洋房和溪园 今8月交房 三房朝南 随时看,3室2厅|121O|中层（共11层）|南北向|2021年建|刘兆盟,和溪园中新生态城-和溪园,16528元/O,200万
天津,上海道大三居商品房全明通透户型 明厅采光好 满五,3室2厅|133.26O|高层（共7层）|南北向|2017年建|马伟丛,文静里马场街-河西区文静路与宾友道交口南侧,23938元/O,319万
天津,南北通透 中梁石榴滨海湾 3室2厅 精装修,3室2厅|106O|中层（共26层）|南北向|李明,中梁石榴滨海湾于家堡-洞庭路与上海道交汇处万达广场南侧,17735元/O,188万
天津,"海景房,大三室,次顶楼,满五",3室2厅|123.95O|高层（共33层）|南北向|2017年建|李猛军,力高一期雍海苑中新生态城-(滨海新区)海滨大道力高一期雍海苑,7180元/O,89万
天津,鲲贝园1居室空间大低楼层主卧客厅朝南看房有钥匙,1室2厅|74O|中层（共18层）|南北向|2014年建|杨继金,鲲贝园中新生态城-开发区和惠路与和畅路交口东北侧,10270元/O,76万
天津,中新生态城 新交房 贻成学府壹号 楼下就是南开 四社区 万达,3室2厅|100O|中层（共30层）|南北向|2020年建|刘兆盟,贻成学府壹号中新生态城-中新生态城中部核心区华一路与中天大道交口,14400元/O,144万
天津,中间楼层醉合适一套 南北通透 金地艺华年 3室2厅 钥匙在手,3室2厅|98.87O|高层（共33层）|南北向|2014年建|李明文,金地艺华年双港镇-金地艺华年,13755元/O,136万
天津,德庆里 1室1厅 49.29平,1室1厅|49.29O|低层（共7层）|南向|2006年建|宋宝静,德庆里兴南街-南开二马路与月纬路交口,34692元/O,171万
天津,南北通透卡梅尔天辉3室2厅精装修,3室2厅|202O|高层（共30层）|南北向|2007年建|孙艳艳,卡梅尔天辉懊方-梅江南居住区环岛东路西侧,28712元/O,580万
