城市,标题,房源信息描述,房源位置信息,单价,房总款
天津,南北通透融创城融林园3室2厅,3室2厅|128.25O|底层（共6层）|南北向|2016年建|李盼盼,融创城融林园万新街-津滨大道与登州南路交口,30409元/O,390万
天津,泰达御海 102平两室 简单装修 诚心出售 图片真实有钥匙,2室1厅|102O|低层（共24层）|南向|2006年建|张彦,泰达御海北塘-北塘经济区常州道(北塘大街北侧),9215元/O,94万
天津,天安珑园 品质房源 随时看房 周边配套齐全,3室2厅|143O|中层（共23层）|南北向|2023年建|王开广,天安数码城珑园张家窝-赛达大道与柳口路交汇处,13286元/O,190万
天津,正南 鸿正富贵嘉园 2室2厅,2室2厅|93.76O|低层（共32层）|南向|2011年建|李明,鸿正富贵嘉园塘沽-新港路与新港一号路交口北侧,14505元/O,136万
天津,南北通透金隅悦城品香苑2室2厅精装修,2室2厅|85.71O|低层（共16层）|南北向|2012年建|李盼盼,金隅悦城品香苑万新街-津滨大道南侧登州南路与惠山道交口,19250元/O,165万
天津,"桂荷园,好户型,两室H双卫,带电梯洋房",2室2厅|108.2O|高层（共7层）|南北向|2017年建|杨志强,桂荷园嘉陵道-红旗路218号,35582元/O,385万
天津,"明星三居精装,低密电梯洋房",3室2厅|108O|底层（共18层）|南向|2016年建|赵喜庆,合景悦府临港经济区-中部新城金岸六道与银河二道交口南侧,9259元/O,100万
天津,《易家真、房》静溪园 低楼层两室 双阳户型 精装 出门有地铁,2室2厅|91.42O|中层（共5层）|南北向|2005年建|刘柱,金厦新都静溪园李七庄-天津市西青区雅乐道与瑶环路交口东南角,22423元/O,205万
天津,(新)免中jie费倒找钱返现金新梅江 准现房 中海开发,3室2厅|89.48O|中层（共26层）|南北向|2023年建|吴磊,中海左岸源境东海街-枫林路与泗水道交口,35762元/O,320万
天津,正南 城市别墅 4室3厅,独栋|卧室：4个|无花园|193.79O|南向|补仙童,城市别墅瑞江-郁江道33号丽舍园,35605元/O,690万
天津,3室2厅 南北 精装修 1,3室2厅|126O|高层（共30层）|南北向|2011年建|朱学莉,碧海长住新河街-塘沽区车站北路与津塘高速公路交口,13650元/O,172万
天津,"急售低楼层标准两大室,户型方正可落户,价格面议。",2室1厅|100O|低层（共43层）|西向|吴婷,"君临天下光复道-博爱道1号,博爱道与民族路交口",8000元/O,80万
天津,小房大院 211平米小独栋 600平米方正花园 随时看房,独栋|卧室：4个|花园：600平米|211O|南向|岳津,京津新城别墅宝坻温泉城-沿津蓟高速往蓟县方向3号出口,10426元/O,220万
天津,《易家真、房》松江城非顶两室 采光好 户型佳 楼下有地铁,2室1厅|87.19O|高层（共32层）|南北向|2014年建|刘柱,松江城李七庄-津涞道与瑶琳路交口南侧,16515元/O,144万
天津,正南力高阳光海岸别墅3室2厅精装修,独栋|卧室：3个|无花园|124O|南向|明凤,力高阳光海岸别墅中新生态城-滨海旅游区航北路与湖滨路交口,7983元/O,99万
天津,万科霞光道五号5室3厅精装修,独栋|卧室：5个|无花园|258O|南向|许帅帅,万科霞光道五号体育中心街-卫津南路与霞光道交口,75581元/O,1950万
天津,贻顺园 103平111万 满五年 3楼 可改三室,2室2厅|103O|中层（共7层）|南北向|王传刚,贻顺园向阳街-沈阳道101号,10776元/O,111万
天津,集体户口可以买房屋装修好独用面积大总价低有固定房租,1室0厅|22.27O|高层（共6层）|南向|2018年建|胡懿玲,向荣里马场街-河西区宾友道与文静路交口西侧,59721元/O,133万
天津,南北通透禧顺花园2室1厅,2室1厅|111.87O|中层（共7层）|南北向|许帅帅,禧顺花园嘉陵道-元阳道3号,33968元/O,380万
天津,南北通透凌研里2室1厅,2室1厅|63.91O|顶层（共6层）|南北向|许帅帅,凌研里体育中心街-红旗南路与凌庄子道交口南侧,22688元/O,145万
天津,城投万欣城精工装优质特惠好房 120平米 贰大生活圈 好,3室2厅|120.4O|中层（共20层）|南北向|徐桂金,天房万欣城上杭路-津滨大道与顺达路交口东侧,26677元/O,321.2万
天津,《易家真、房》柏景湾联排别墅 原购价440万 认赔50急出,4室2厅|144O|底层（共3层）|南北向|2016年建|刘柱,中骏柏景湾精武镇-南奥体津涞公路南侧中骏柏景湾,27430元/O,395万
天津,吾悦广场旁中粮公馆精装交付南北通透四室,4室2厅|119O|底层（共18层）|南北向|2022年建|李明,"天津中梁公馆新河街-海洋高新区云山道吾悦广场以北,海缘东路以西",13529元/O,161万
天津,河西一pian 湘江道 棉二大院 2楼 两室 私产 有装修,2室1厅|57.63O|低层（共7层）|东西向|1988年建|杨滨,新南楼下瓦房-解放南路329号,39909元/O,230万
天津,现房 现房 海景房可做民宿 随时过户下房本,1室2厅|59.37O|底层（共6层）|南向|2006年建|王飞,京能海语城东疆港-东疆港南端东至欧洲路西至亚洲路,6568元/O,39万
天津,乐至里 中间楼层 私产可贷款 带客厅可摆放沙发电视,1室1厅|44.5O|中层（共6层）|南向|2018年建|杨志强,乐至里嘉陵道-宜宾西道与向阳路交口东南角,20674元/O,92万
天津,电梯洋房 精装三室 小区中心位置 看房方便 诚意出售,3室2厅|148O|高层（共9层）|南北向|高彬,半岛豪庭天潇园梅江-河西区友谊南路与环岛北路交口,33581元/O,497万
天津,宜宾西里 2楼 阳面 采光佳 地铁站200米 随时看 拥金1,1室1厅|29.23O|低层（共6层）|东南向|2006年建|李,宜宾西里嘉陵道-南开区宜宾道与罗江路交口,14368元/O,42万
天津,南北通透欣居园2室1厅,2室1厅|93.35O|中层（共6层）|南北向|许帅帅,欣居园体育中心街-红旗南路532号,25709元/O,240万
天津,时代奥城酒店式公寓1室1厅,1室1厅|53.43O|中层（共29层）|东向|2005年建|许帅帅,时代奥城酒店式公寓体育中心街-宾水西道与凌宾路交口西侧600米,16844元/O,90万
天津,天华里 3室2厅1卫 普通装修 360万元,3室2厅|108.3O|中层（共6层）|南北向|2017年建|郑旭坤,天华里华苑-天津市南开区华苑雅士道与华苑路交口西侧,31855元/O,345万
天津,"国营推荐 免拥金 南开中片 直管公产,独厨,总价低",1室1厅|18.49O|顶层（共5层）|南向|2018年建|赵仲华,南开区长江里万兴街-南开区灵隐道与苏堤路交口附近,24337元/O,45万
天津,河西红盘!新梅江板块!带精装修 送车位,2室2厅|82O|中层（共18层）|南向|2023年建|王开广,中海左岸源境东海街-枫林路与泗水道交口,40000元/O,328万
天津,南北通透金隅悦城嘉悦园2室2厅精装修,2室2厅|93.4O|中层（共9层）|南北向|2010年建|李盼盼,金隅悦城嘉悦园万新街-津滨大道与跃进路交口,15845元/O,148万
天津,"上海道,总价低,拆间里面的大独厨,业主诚意出售",1室0厅|22.29O|顶层（共6层）|东向|2018年建|胡懿玲,生昌里马场街-文静路30号,59219元/O,132万
天津,云居里 2室2厅1卫 简装 409万元 119.9平米,2室2厅|119.97O|顶层（共7层）|南北向|2018年建|韩建强,云居里万兴街-长江道与白堤路交口南侧,33341元/O,400万
天津,捡漏 海逸恋海园 三室 户型好用 带车位的一套,3室2厅|160O|中层（共24层）|南北向|王丽丽,海逸长洲恋海园李七庄-友谊南路与绥江道交口西南侧,25000元/O,400万
天津,生态城 南开旁 二次装修 临近轻轨Z4 随时看房 着急卖,3室2厅|114.44O|低层（共30层）|南北向|2022年建|李猛军,贻成学府壹号中新生态城-中新生态城中部核心区华一路与中天大道交口,16602元/O,190万
天津,"(总监推荐)中间层,采光无遮挡,产权清晰。",2室1厅|60.56O|中层（共6层）|南北向|2017年建|杨志强,云阳东里嘉陵道-南开区雅安道与泊江路交口西北侧,25099元/O,152万
天津,御景园洋房精装四居房主诚心卖价位能谈 看房方便,4室2厅|184.62O|中层（共7层）|北向|2008年建|赵云江,御景园邸第二大街-开发区第二大街10号,15437元/O,285万
天津,天津生态城万达广场 129平3居 南北向精装修 自住保养好,3室2厅|129O|中层（共18层）|南北向|2018年建|刘兆盟,天津生态城万达广场中新生态城-中新生态城中天大道与和意路交汇处,18992元/O,245万
天津,"燕云小镇,中户,纯毛坯,得房率高,南带水系北带车位",独栋|卧室：3个|无花园|200.71O|东向|朱秀云,燕云小镇武清-大东线与高王路交口京津高速泗村店出口西侧,7224元/O,145万
天津,闽侯路 私产 精装修 低楼层 随时可签 不临街产权清晰,2室1厅|47.25O|底层（共6层）|南北向|2017年建|张寰,祺寿里大营门-河西区绍兴道与九江路交口,56931元/O,269万
天津,南北通透宝龙城3室2厅精装修,3室2厅|88O|底层（共11层）|南北向|2016年建|明凤,宝龙城中新生态城-滨海旅游区海旭道与安明路交口,13409元/O,118万
天津,振业御湖 洋房三居室 精装修 团购优惠,3室2厅|114O|底层（共18层）|南向|2023年建|李明,"振业御湖新河街-海洋科技园海缘路以西,智祥道以北",18421元/O,210万
天津,宝兴里 58平2居 南北向简装修 视野无遮挡 采光好 交通便,2室1厅|58O|顶层（共5层）|南北向|马云龙,宝兴里鸿顺里-河北区二马路与宙纬路交口西侧,19827元/O,115万
天津,泰丰公园 颂景园 泰丰七号 大宽厅 电梯房 俯瞰泰丰公园,3室2厅|145O|高层（共15层）|南北向|2020年建|程龙凯,泰丰七号第五大街-开发区泰丰路与第四大街交口,31034元/O,450万
天津,精装四室 南北通透 新出好房 小区中心 价格合适 诚意出售,4室2厅|182O|中层（共26层）|南北向|高彬,富力津门湖清溪花园李七庄-河西紫金山路与珠江道交口西侧,21813元/O,397万
天津,南北通透超英家园2室1厅精装修,2室1厅|124.7O|中层（共21层）|南北向|2000年建|许帅帅,超英家园八里台-天津市南开红旗南路与宾水西道交口,23255元/O,290万
天津,"急售急售 南开 此房商品房房本,5楼的,近地铁,中片",1室1厅|44.25O|中层（共7层）|西向|2018年建|曹君,月环里学府街-红旗路282号,19661元/O,87万
天津,开发区一大街 津滨藏锦 通透2室2厅 一楼带40平米小院,2室2厅|107.27O|底层（共6层）|南北向|2012年建|张彦,津滨藏锦第一大街-顺达街88号,25170元/O,270万
天津,"此房私产满两年,客厅宽敞明亮没有遮挡",2室1厅|60.24O|中层（共6层）|南向|2017年建|杨志强,川北里嘉陵道-宜宾道与密云路交口西侧,20252元/O,122万
天津,"新北家园 现房1室 单价8千,即买即住,火爆销售中",1室1厅|50O|中层（共28层）|南北向|王传刚,海泽苑北塘-天津市滨海新区晋州道海泽苑,8000元/O,40万
天津,《易家真、房》柏景湾一楼三室 通透户型 刚需必看 44万即可,3室2厅|95.97O|低层（共13层）|南北向|2016年建|刘柱,中骏柏景湾精武镇-南奥体津涞公路南侧中骏柏景湾,14483元/O,139万
天津,"老空无,楼层好,采光好,配套设施齐全",2室1厅|89.13O|中层（共29层）|南向|2021年建|朱秀云,鑫苑汤泉世家武清-京津高速泗村店东出口右转直行约2公里处,5161元/O,46万
天津,卫安中里 一室 私产 满五年 诚意出售,1室1厅|38.69O|顶层（共7层）|东向|2017年建|杨志强,卫安中里广开街-西马路与南大道交口西北侧,30498元/O,118万
天津,正南金地里1室2厅企业推荐房源,1室2厅|71O|中层（共6层）|南向|许帅帅,金地里体育中心街-体育中心街道红旗南路494号,29014元/O,206万
天津,老城区 改善 3室2卫 126平米,3室2厅|126O|高层（共28层）|南北向|王传刚,四季雅苑新河街-车站北路578号,14682元/O,185万
城市,标题,房源信息描述,房源位置信息,单价,房总款
天津,南北通透保富国际2室1厅精装修,2室1厅|135O|高层（共30层）|南北向|许帅帅,保富国际体育中心街-绥江道与卫津南路交口,14074元/O,190万
天津,金茂智慧科学城89O环内精装修洋房产品 万达爱琴海出行即达,3室2厅|89.7O|高层（共9层）|南北向|2022年建|李源,上东金茂智慧科学城万新街-津滨大道与雪山路交口,20264元/O,181.77万
天津,"精装通透两室,拎包入住,交通便利,出行方便,采光好",2室2厅|117.07O|高层（共18层）|南北向|2017年建|杨志强,格调春天广开街-天津市南开区广开四马路82号,48517元/O,568万
天津,南北通透时代奥城酒店式公寓1室1厅精装修,1室1厅|28.99O|高层（共23层）|南北向|2005年建|许帅帅,时代奥城酒店式公寓体育中心街-宾水西道与凌宾路交口西侧600米,24146元/O,70万
天津,"君临天下精装修180平阳面大复式,面朝海河视野好",3室2厅|180O|中层（共43层）|南向|2010年建|吴婷,"君临天下光复道-博爱道1号,博爱道与民族路交口",13055元/O,235万
天津,"新南江,2000年楼龄,前后不临街,大一室一厅,诚心卖",1室1厅|55.71O|中层（共6层）|南向|2017年建|杨志强,南江西里嘉陵道-云阳道与南江路交口西南侧,22437元/O,125万
天津,私房急售!南北通透137.00万元118.10平,2室2厅|118.1O|中层（共19层）|南北向|2015年建|李玉强,双威悦馨苑中新生态城-中新大道3681号,11600元/O,137万
天津,中国铁建・花语天宸目前13-14在售,3室1厅|87O|底层（共1层）|南向|2018年建|李洋,中国铁建国际城建昌道-金钟河大街与中环线交口(金钟河大街245号),16666元/O,145万
天津,工抵中交融正高层在售好楼层,3室1厅|108O|中层（共25层）|南向|2018年建|李洋,中交融正陈塘庄-大沽南路与学苑路交口以南300米,31481元/O,340万
天津,"宫,免拥金平房一间 咸阳路 规划 赠送一间屋 随时看",1室0厅|27O|底层（共1层）|南向|1980年建|宫德芬,雅园里长虹街-芥园西道与咸阳路交口东南侧,25925元/O,70万
天津,锦绣大家88O 海教园学籍 可上市区 洋房社区 大学环保,3室2厅|88.5O|低层（共7层）|南北向|徐桂金,锦绣大家海河教育园-海河教育园区和慧南路与同心路交口东南侧,16937元/O,149.9万
天津,生态城 博与海 精装交房 单价低 低密度 推荐新房,2室2厅|82O|低层（共18层）|南北向|2018年建|穆洋,博屿海中新生态城-生态城北区中新大道与中海大道交汇,9512元/O,78万
天津,首创新北京半岛 禧悦晴朗 一梯两户洋房 有地下室,3室2厅|99.1O|低层（共11层）|南北向|2018年建|朱秀云,首创新北京半岛禧悦里武清-高村乡京津高速永乐站收费口前行300米,7063元/O,70万
天津,南北通透时代奥城酒店式公寓1室1厅精装修,1室1厅|45.28O|中层（共31层）|南北向|2011年建|许帅帅,时代奥城酒店式公寓体育中心街-宾水西道与凌宾路交口西侧600米,22747元/O,103万
天津,《易家真、房》人和院洋房2楼 带精装 增露台,2室2厅|98.56O|中层（共5层）|南向|2012年建|刘柱,人和院李七庄-津涞公路与外环线交口,16538元/O,163万
天津,南北通透欣居园2室1厅,2室1厅|81.18O|高层（共7层）|南北向|许帅帅,欣居园体育中心街-红旗南路532号,24020元/O,195万
天津,南北通透碧华里2室1厅,2室1厅|102.51O|中层（共6层）|南北向|许帅帅,碧华里华苑-碧华支路2号,35118元/O,360万
天津,大直沽地铁站 2楼阳面47万全包 集体户可 老人居住,1室1厅|24.24O|低层（共6层）|南北向|1995年建|陈娜,大直沽前街小区大直沽-河东区大直沽前街与大直沽中路交口,19389元/O,47万
天津,代理 8000起 带装修 77到130平 有兴趣看看,3室2厅|103O|中层（共15层）|南北向|2018年建|穆洋,博屿海中新生态城-生态城北区中新大道与中海大道交汇,9699元/O,99.9万
天津,时代奥城酒店式公寓1室1厅,1室1厅|55O|高层（共29层）|西北向|2002年建|许帅帅,时代奥城酒店式公寓体育中心街-宾水西道与凌宾路交口西侧600米,18181元/O,100万
天津,南北通透金福南里2室1厅,2室1厅|70O|中层（共6层）|南北向|许帅帅,金福南里体育中心街-红旗南路与黑牛城道交口,22857元/O,160万
天津,南湖现房天地源熙湖畔洋房3居2卫带50平小院随时看房,3室2厅|114O|低层（共7层）|南北向|2020年建|寇井红,天地源熙湖畔武清-郎庄子道与天湖路交口,10701元/O,122万
天津,"新北家园 现房1室 单价8千,即买即住,火爆销售中",1室1厅|50O|中层（共28层）|南北向|王传刚,海泽苑北塘-天津市滨海新区晋州道海泽苑,8000元/O,40万
天津,正南招商钻石山1室1厅,1室1厅|53.19O|中层（共18层）|南向|2006年建|许帅帅,招商钻石山体育中心街-卫津南路与水上公园北道交口,28200元/O,150万
天津,中冶德贤公馆 七贤南里 看上户小户型1室1厅高层采光好,1室1厅|57.15O|高层（共28层）|西向|2020年建|张飞,中冶德贤公馆陈塘庄-大沽南路与洪泽路交口(靠近中环),17847元/O,102万
天津,《易家真、房》精武镇 2楼标准H户型两室 单价1万2 刚需房,2室2厅|93O|中层（共5层）|南北向|2010年建|刘柱,恒益隆庭精武镇-南河镇荣华道南侧,11451元/O,106.5万
天津,正南 鸿正富贵嘉园 2室2厅,2室2厅|93.76O|低层（共32层）|南向|2011年建|李明,鸿正富贵嘉园塘沽-新港路与新港一号路交口北侧,14505元/O,136万
天津,首创新北京半岛 108平3居 洋房现房低密社区近北京,3室2厅|108O|低层（共7层）|南北向|高峰,首创新北京半岛武清-高村乡京津高速永乐站收费口前行300米,10740元/O,116万
天津,正南 红|领世郡普霖花园 4室2厅,独栋|卧室：4个|无花园|267.48O|南向|张娜,红|领世郡普霖花园双港镇-友谊南路与外环线交口东行三公里处领世郡版块内,30656元/O,820万
天津,南北通透盛泰公寓3室2厅,3室2厅|139.08O|高层（共7层）|南北向|2001年建|王亮,盛泰公寓第三大街-洞庭路82号,9994元/O,139万
天津,开发区融科瀚棠 厅带阳台2室 精装 居住舒适度高,2室1厅|91.22O|低层（共23层）|南向|2015年建|吕建学,融科瀚棠第五大街-开发区第四大街与泰祥路交口,19732元/O,180万
天津,"(总监推荐)中间层,采光无遮挡,产权清晰。",2室1厅|60.56O|中层（共6层）|南北向|2017年建|杨志强,云阳东里嘉陵道-南开区雅安道与泊江路交口西北侧,25099元/O,152万
天津,城投万欣城精工装优质特惠好房 110平米 贰大生活圈 好,3室2厅|110.2O|高层（共20层）|南北向|徐桂金,天房万欣城上杭路-津滨大道与顺达路交口东侧,25407元/O,279.99万
天津,"通透户型采光好,没有遮挡,房东干脆,诚心出售",3室2厅|89O|高层（共18层）|南向|2016年建|朱秀云,哈兰庄园武清-泗村店镇龙河路西侧益兰园,5617元/O,50万
天津,南北通透 富力津门湖观鹭花园 4室2厅 精装修,4室2厅|179.55O|低层（共18层）|南北向|2010年建|张琳,富力津门湖观鹭花园李七庄-江湾路与绥江道交口东北侧500米,33416元/O,600万
天津,《易家真、房》瑞民里 中间楼层标准H户型两室 首付25万即可,2室2厅|101.99O|中层（共6层）|南北向|2012年建|刘柱,小镇西西里瑞民里精武镇-精武镇(原南河镇)中心京华道南侧,11569元/O,118万
天津,"精装修140平跃层双卫带燃气,中低楼层电梯方便",2室1厅|140O|低层（共43层）|北向|吴婷,"君临天下光复道-博爱道1号,博爱道与民族路交口",9642元/O,135万
天津,雅园 精装通透2室 带车位 中间层 低于市场价20万看房方便,2室2厅|89O|低层（共6层）|南北向|1998年建|赵云江,雅园第三大街-腾飞路16号,18651元/O,166万
天津,《易家真、房》柏景湾联排别墅 原购价440万 认赔50急出,4室2厅|144O|底层（共3层）|南北向|2016年建|刘柱,中骏柏景湾精武镇-南奥体津涞公路南侧中骏柏景湾,27430元/O,395万
天津,"精装两居室,平面车位,楼下有公园",2室1厅|96.79O|高层（共26层）|南北向|2017年建|程龙凯,双威悦馨苑中新生态城-中新大道3681号,13947元/O,135万
天津,《易家真、房》开源里 2楼老少居 一个房本 单价9500,3室2厅|135.6O|低层（共6层）|南北向|2005年建|刘柱,西青开源里精武镇-南河镇荣华道南侧,9218元/O,125万
天津,西青红盘 万科开发商,3室2厅|125O|中层（共24层）|南向|2023年建|王开广,万科西华府中北镇-海泰南北大街城建大学旁(北侧)。,25600元/O,320万
天津,禧顺花园通透两室满五明厅带车位诚卖价可议,2室1厅|79.22O|中层（共6层）|南北向|2017年建|杨志强,禧顺花园嘉陵道-元阳道3号,30169元/O,239万
天津,(新)免中jie费倒找钱返现金新梅江 准现房 中海开发,3室2厅|89.48O|中层（共26层）|南北向|2023年建|吴磊,中海左岸源境东海街-枫林路与泗水道交口,35762元/O,320万
天津,南江东里 南北通透 采光好 3楼 私产可贷款,2室1厅|44.35O|中层（共5层）|南北向|2017年建|杨志强,南江东里嘉陵道-南开区雅安道咸阳路交口西北侧,31116元/O,138万
天津,《易家真、房》柏景湾 小高层通透四室 带装修 首付60万办齐,4室1厅|109.4O|高层（共11层）|南向|2016年建|刘柱,中骏柏景湾精武镇-南奥体津涞公路南侧中骏柏景湾,16087元/O,176万
天津,"宫,南开北片汾水道片,5/5楼低价,两室南北朝向",2室1厅|58O|顶层（共5层）|西向|1997年建|宫德芬,原平里向阳路-汾水道142号,16034元/O,93万
天津,南北通透 海逸长洲瀚景园 2室1厅,2室1厅|87.4O|中层（共24层）|南北向|2007年建|张琳,海逸长洲瀚景园梅江-友谊南路与绥江道交口西侧,34324元/O,300万
天津,房子二次精装修 两个车位 中上层楼 出门季景天地,2室1厅|91.25O|中层（共15层）|南向|2017年建|程龙凯,季景华庭中新生态城-中新生态城和旭路1060号,14794元/O,135万
天津,南北通透水上温泉花园2室1厅,2室1厅|109.81O|底层（共6层）|南北向|2003年建|许帅帅,水上温泉花园八里台-天津市南开区宾水西道186号,34514元/O,379万
天津,南北通透全运村云实园3室2厅精装修,3室2厅|119.86O|低层（共26层）|南北向|2015年建|刘双,全运村云实园东海街-洞庭路与渌水道交口,38795元/O,465万
天津,南北通透东方和府3室2厅,3室2厅|143O|底层（共7层）|南北向|李盼盼,"东方和府万新街-张贵庄南侧居住区,西至跃进北路、南至惠山道",21678元/O,310万
天津,"新河中医院一路之隔,新馨家园 97平96万 中间层电梯房",2室1厅|97O|高层（共28层）|南北向|王传刚,新馨家园新河街-厦门路与云山道交口二号水库北,9896元/O,96万
天津,银山南里私产房 阳面一室 二附属 五号线 幸福公园旁,1室1厅|34.39O|中层（共6层）|南向|2018年建|李丽,银山南里江都路-如皋路6号,14510元/O,49.9万
天津,吾悦广场旁 中梁公馆 准现房 通透两室 价格可谈 车接车送,2室2厅|78O|底层（共18层）|南北向|2022年建|刘兆盟,"天津中梁公馆新河街-海洋高新区云山道吾悦广场以北,海缘东路以西",11538元/O,90万
天津,电梯洋房 精装三室 H+1 南北通透 采光,3室1厅|103O|低层（共10层）|南北向|2018年建|张飞,格调绮园尖山街-黑牛城道与太湖路交口,27669元/O,285万
天津,《易家真、房》融泰城 洋房一楼带带小院 养老改善天花板,3室2厅|110.35O|底层（共8层）|南北向|2020年建|刘柱,融泰城李七庄-津涞公路与秀川路交口,24014元/O,265万
天津,"五马路,采光视野佳,业主靠谱卖",2室2厅|96O|顶层（共18层）|南向|2017年建|杨志强,格调春天广开街-天津市南开区广开四马路82号,50520元/O,485万
天津,台湾路阳面精致独厨 前无遮挡 采光倍儿好 走路上学,1室0厅|26.16O|高层（共5层）|南向|2018年建|张寰,台湾路公寓下瓦房-台湾路与绍兴道交口,100152元/O,262万
天津,南北通透 水岸江南 2室2厅 精装修,2室2厅|86.23O|顶层（共18层）|南北向|2009年建|王路路,水岸江南梅江-天津市西青区友谊南路梅江南居住区11号地,27832元/O,240万
城市,标题,房源信息描述,房源位置信息,单价,房总款
天津,生态城 博与海 精装交房 单价低 低密度 推荐新房,2室2厅|82O|低层（共18层）|南北向|2018年建|穆洋,博屿海中新生态城-生态城北区中新大道与中海大道交汇,7926元/O,65万
天津,南北通透金福南里2室1厅,2室1厅|69.81O|顶层（共6层）|南北向|2001年建|许帅帅,金福南里体育中心街-红旗南路与黑牛城道交口,16759元/O,117万
天津,南北通透盈艺园3室2厅,3室2厅|135O|高层（共32层）|南北向|许帅帅,盈艺园嘉陵道-天拖北道北侧,39629元/O,535万
天津,中海寰宇天下 电梯洋房 4室2厅三阳开泰 精装修 居家自住,4室2厅|158.82O|中层（共10层）|南北向|2018年建|张飞,中海寰宇天下陈塘庄-洞庭路与黑牛城道交口,48161元/O,764.9万
天津,南北通透水上温泉花园3室2厅精装修,3室2厅|174.76O|中层（共11层）|南北向|2002年建|许帅帅,水上温泉花园八里台-天津市南开区宾水西道186号,26321元/O,460万
天津,南北通透金福南里2室1厅,2室1厅|70O|中层（共6层）|南北向|许帅帅,金福南里体育中心街-红旗南路与黑牛城道交口,22857元/O,160万
