城市,标题,房源信息描述,房源位置信息,单价,房总款
天津,无费用 公产 和平二片 中心小W 有W籍,2室1厅|15.69O|底层（共2层）|南北向|于万丽,长春道小区劝业场街-长春道248号,152963元/O,240万
天津,全包好房 和平三片 新华南路 公产 可贷款,1室0厅|26.9O|底层（共3层）|东向|2017年建|于万丽,民园东里体育馆街-大理道8号,61710元/O,166万
天津,免中阶免过户 万全双选 面积足 集体户口可落户 可公易贷,1室0厅|16.95O|底层（共1层）|南北向|于万丽,平仪里南市-和平区荣安街平仪里6号,116814元/O,198万
天津,国企好赞房源 和平二片中心小W 公产可公易贷 钥匙房 随时看,1室1厅|18.24O|顶层（共5层）|南北向|于万丽,复元里南营门--昆明路39号,128837元/O,235万
天津,国企好赞无费用 和平一片 万全有座位 公产可公易贷 钥匙房,1室1厅|20.05O|顶层（共2层）|南北向|于万丽,蒙古路劝业场街-(和平)和平区蒙古路,102244元/O,205万
天津,国企好赞无费用好房 公产 和平二片 岳阳道小W 钥匙房随时看,1室1厅|11.26O|底层（共2层）|南北向|于万丽,有声里体育馆街-睦南道105号,246891元/O,278万
天津,国营①个点 和平二片 岳阳道有座 低楼层南北向一室,1室1厅|27.93O|低层（共3层）|南北向|于万丽,有声里体育馆街-睦南道105号,100250元/O,280万
天津,全包好房 和平三片 昆明路 公产 南北通透 可贷款,2室1厅|38O|顶层（共6层）|南北向|于万丽,四达里新兴街-昆明路与沙市道交口南侧,72368元/O,275万
天津,无费用 和平二片 公产 中心有座 超大露台,2室1厅|30O|顶层（共3层）|南北向|于万丽,长春道小区劝业场街-长春道248号,79333元/O,238万
天津,兴云里 电梯2居 南北向简装修 方便看房 3楼3楼3楼,2室1厅|84.67O|中层（共7层）|南北向|2018年建|侯震东,兴云里广开街-西营门大街9号,32715元/O,277万
天津,南北通透全运村云实园3室2厅精装修,3室2厅|120.52O|顶层（共23层）|南北向|2015年建|齐玉江,全运村云实园东海街-洞庭路与渌水道交口,36093元/O,435万
天津,广云花园 中芥1% 五马路小? 3楼 白菜价格 急售,2室2厅|99.33O|中层（共6层）|东西向|2006年建|张广丽,"广云花园广开街-广开四马路与广开南街交口,南开区教育局对面",33121元/O,329万
天津,紫光苑 2室1厅 74.87平,2室1厅|74.87O|低层（共7层）|南北向|2006年建|张广丽,紫光苑兴南街-南门外大街与荣安大街交口,35928元/O,269万
天津,首创禧瑞府现房叠拼 带地下室 带小院 电梯直接入户,4室1厅|168O|底层（共3层）|南北向|2018年建|刘占元,龙湖首创禧瑞郦城中北镇-中北镇阜锦道与金霞路交口西北侧,33035元/O,555万
天津,和平一片 鞍山道有位置 产权清晰 可贷款 独立厨房带阳台,1室0厅|18O|顶层（共2层）|南北向|于万丽,沈阳道小区劝业场街-沈阳道与辽宁路交口,76666元/O,138万
天津,风荷新园 中芥1% 洋房五马路小W 拎包入住 急卖,2室2厅|91.14O|高层（共7层）|南北向|2006年建|张广丽,风荷新园广开街-西市大街35号,35110元/O,320万
天津,免 o 好 房 鞍山道有W籍 2楼公产 350万办齐,2室1厅|51O|低层（共3层）|南北向|1980年建|于万丽,文通里劝业场街-宁夏路文通里小区,68627元/O,350万
天津,中介fei百分之120付小片2楼全明两室在家能看见61中操场,2室1厅|65O|中层（共4层）|南北向|1990年建|孙丽娟,青岛道小白楼街-天津市和平区小白楼,51538元/O,335万
天津,大直沽地铁站 2楼阳面47万全包 集体户可 老人居住,1室1厅|24.24O|低层（共6层）|南北向|1995年建|仲麒,大直沽前街小区大直沽-河东区大直沽前街与大直沽中路交口,19389元/O,47万
天津,"yong今1%,宇正园洋房,紧邻DT站,南北通透三室",3室2厅|139.9O|低层（共13层）|南北向|2006年建|孟凡超,宇正园广开街-黄河道146号,37526元/O,525万
天津,"中介fei百分之1,西康路小W片三片全阳两室不着急卖",2室1厅|55O|中层（共6层）|南北向|1990年建|孙丽娟,和平区迎春里新兴街-西康道与宜昌路交口,40000元/O,220万
天津,万科新梅江柏翠园 直降万 156平3居 南北向豪华装修,3室2厅|156O|中层（共11层）|南北向|张飞,万科新梅江柏翠园梅江-太湖路解放南路新梅江太湖路公园与卫津河公园旁,31730元/O,495万
天津,"中介fei百分之1,新星小W片电梯复式上下两层86O民水民电",1室2厅|43.15O|低层（共20层）|南北向|2015年建|孙丽娟,瑞竹大厦南营门-和南京路239号,48667元/O,210万
天津,先春园隆春里 钻石2楼 中芥1% 业主急卖 价格可谈,2室1厅|87.19O|低层（共6层）|南北向|2006年建|张广丽,先春园隆春里芥园道-红桥区芥园道与复兴路交口,28214元/O,246万
天津,拥金1 汇福华庭次顶!我是维护人知道底价! 南北通透H户型!,2室1厅|108.65O|顶层（共9层）|南向|2017年建|张哲,汇福华庭兴南街-南门外大街与南开二马路交口,47399元/O,515万
天津,生态城 博与海 精装交房 单价低 低密度 目送式单价8K靠谱,3室2厅|108O|底层（共7层）|南北向|2018年建|张伟,博屿海中新生态城-生态城北区中新大道与中海大道交汇,8148元/O,88万
天津,中海招商十里观澜 3室2厅1卫 毛坯 290万元,3室2厅|96.04O|低层（共28层）|南北向|2023年建|刘占元,中海招商十里观澜新开河-天泰路与富运道交口,30195元/O,290万
天津,房子属于精装两居可以拎包入住 房子没怎么住 随时看房急售,2室1厅|81.77O|顶层（共15层）|南向|2017年建|朱显晶,世茂Z苑中新生态城-和惠路11号,13452元/O,110万
天津,吉宝 季景峰阁 生态城精装二居室户型好采光视野好价位可谈,2室1厅|82O|中层（共31层）|南向|2017年建|朱显晶,季景峰阁中新生态城-和风路与和畅路交口。,13414元/O,110万
天津,生态城荣馨园豪装大三居中间楼层有车位户型方正有钥匙随时看,3室2厅|144.6O|低层（共18层）|南北向|2017年建|朱显晶,荣馨园中新生态城-和风路764号,13139元/O,190万
天津,中芥1% 兴泰园 新登记房源 大三居室 精装修 随时看房,3室1厅|110.78O|中层（共6层）|南北向|2006年建|张广丽,兴泰园万兴街-兴泰里2号,37822元/O,419万
天津,新房加30分 电梯洋房 88平三室62万 找我买房有优惠,3室1厅|88O|高层（共8层）|南北向|2020年建|张伟,雅居乐滨河雅郡中新生态城-中新生态城中生大道与泰九路交口,7045元/O,62万
天津,.新房 现房现房 加30分新政策落地可以直接来天津罗湖了.,1室1厅|52O|中层（共6层）|南向|2006年建|李爱军,海阔苑北塘-天津市滨海新区天池路海阔苑,6153元/O,32万
天津,拥金1 三潭东里1楼赠小院!南开小学Z哇塞的精装1室!嘎嘎棒,1室1厅|40.82O|底层（共7层）|北向|2018年建|张哲,三潭东里万兴街-南开区鞍山西道与三潭路交口东北角,31847元/O,130万
天津,南北通透海逸长洲恋海园4室2厅,4室2厅|201.74O|低层（共26层）|南北向|2010年建|齐忠将,海逸长洲恋海园李七庄-友谊南路与绥江道交口西南侧,28006元/O,565万
天津,竹径里 单价低 次顶楼 南北通透 中芥1% 急卖,2室1厅|85.6O|高层（共6层）|南北向|2006年建|张广丽,竹径里万兴街-西湖村大街42号增1号,24415元/O,209万
天津,w实房源改善必看好房季景兰庭大三居万科物业绿化随时看房,3室2厅|130O|低层（共13层）|南北向|2017年建|朱显晶,吉宝季景兰庭中新生态城-吉宝季景兰庭,14615元/O,190万
天津,新兴里 2室1厅1卫 简装 340万元 64.36平米,2室1厅|64.53O|中层（共4层）|南北向|2018年建|李凤超,新兴里新兴街-福建路284号,51913元/O,335万
天津,生态城首付低 南北通透三室洋房 精装修 低价出售 收藏,3室2厅|89O|底层（共6层）|南向|2006年建|陈浩,雅居乐滨河雅郡中新生态城-中新生态城中生大道与泰九路交口,8764元/O,78万
天津,"风荷园 批商品房,中间楼层,南北通透阳面厅H户型",2室2厅|100.99O|高层（共7层）|南北向|孟凡超,风荷园万兴街-西湖道与白堤路交口西侧,31191元/O,315万
天津,私产满五年 一楼三室 看房随时 诚心出售{拥今百一},3室1厅|104.05O|低层（共7层）|南北向|2006年建|孟凡超,广灵里长虹街-临潼路与长江道交口北侧,25180元/O,262万
天津,急售电梯洋房 南北通透 首创福缇山香堤苑 3室2厅 精装修,3室2厅|103.19O|高层（共11层）|南北向|2006年建|刘文斌,首创福缇山香堤苑双港镇-首创福缇山香堤苑,20060元/O,207万
天津,中芥1% 凯兴天宝 不到顶三室 业主急售 位置好 五马路,3室2厅|140.03O|顶层（共6层）|西北向|2017年建|邢滨书,凯兴天宝公寓广开街-南开区广开四马路与天宝路交口,29422元/O,412万
天津,万科东第 3室2厅 123.09平,3室2厅|123.09O|中层（共10层）|南北向|2006年建|高明士,万科东第李七庄-卫津南路西侧中医一附院(南院)旁,33715元/O,415万
天津,亲民中介 拥金1 兴华公寓 3楼 商品房 南北通透 开间大,2室1厅|116.22O|中层（共6层）|南北向|2017年建|侯志超,兴华公寓万兴街-南丰路54号,36138元/O,420万
天津,中芥1%宇正园 房龄新 电梯洋房 出门地铁站 九年一贯制,2室1厅|111.36O|中层（共11层）|南向|2017年建|邢滨书,宇正园广开街-黄河道146号,38882元/O,433万
天津,桦林园 电梯房 三室 全明通透 随时看房 业主诚意出售,3室1厅|103.72O|中层（共18层）|东南向|2017年建|杨翠萍,桦林园广开街-西营门大街25号,34516元/O,358万
天津,"总监推荐!南北通透 H户型全明,不临街,五 马路校片",2室1厅|101.67O|中层（共6层）|南北向|2017年建|杨翠萍,凯立天香家园广开街-长江道66号(长江道与青年路交口),40326元/O,410万
天津,英里 3室2厅 124.14平,3室2厅|124.14O|中层（共7层）|南北向|2020年建|高明士,艺英里李七庄-秀川路津宴大酒楼东50米艺英里,19010元/O,236万
天津,萃华里 二楼 面积大 超大阳台 70平交通便利价格可议,2室1厅|46.31O|低层（共7层）|东向|2017年建|赵婧,萃华里王串场-王串场六号路与真理道交口西北角处,17058元/O,79万
天津,远洋万和府生态城起步区一社区旁纯洋房社区低密宜居精装交房,3室2厅|108O|高层（共7层）|南北向|2017年建|朱显晶,远洋万和府中新生态城-中新生态城中天大道与和睦路交口,16666元/O,180万
天津,昆明路有坐位 南北通透 价格全包 随时看房,2室1厅|36.63O|顶层（共6层）|南北向|2017年建|胡博,四达里新兴街-昆明路与沙市道交口南侧,73710元/O,270万
天津,合景精装3室一楼带大概50平米大院 精装修 满五.,3室1厅|109.83O|底层（共11层）|南北向|2017年建|李明文,合景御华园双港镇-双港镇津港高速辅路与景荔道交口,22762元/O,250万
天津,生态城 博与海 精装交房 单价低 低密度 目送式单价8K靠谱,3室2厅|108O|底层（共7层）|南北向|2018年建|李爱军,博屿海中新生态城-生态城北区中新大道与中海大道交汇,8148元/O,88万
天津,凯立天香家园 五马路 3楼 双阳南北通透 着急卖价格好谈,2室1厅|91.24O|中层（共6层）|南北向|2017年建|王鸿,凯立天香家园广开街-长江道66号(长江道与青年路交口),37812元/O,345万
天津,"首创香堤苑,洋房三室,看房方便,出房率高",3室2厅|122.29O|高层（共6层）|南向|2017年建|李明文,首创香堤苑双港镇-梨双公路与微山南路交口南侧,21260元/O,260万
天津,中.介.费①个点 商品房 低楼层 采光好 无遮挡 诚意出售,2室1厅|78.53O|底层（共6层）|西南向|2017年建|孙旺,新义信里大王庄-北长路与八经路交口西侧,19737元/O,155万
天津,碧波园 3室1厅2卫 其它 448万元 162.8平米,3室1厅|162.9O|中层（共6层）|南向|2017年建|郭t健,碧波园大直沽-五号路18-1号,27501元/O,448万
天津,满五 南北通透 2室2厅 精装修 收藏,2室2厅|99.24O|中层（共19层）|南北向|2015年建|王飞,双威悦馨苑中新生态城-中新大道3681号,11588元/O,115万
天津,清泽园 3室2厅 149.65平,3室2厅|149.65O|中层（共6层）|南北向|2006年建|袁欣,清泽园友谊路-柳江路5号,37086元/O,555万
城市,标题,房源信息描述,房源位置信息,单价,房总款
天津,亲民中介 拥金1 兴华公寓 3楼 商品房 南北通透 开间大,2室1厅|116.22O|中层（共6层）|南北向|2017年建|侯志超,兴华公寓万兴街-南丰路54号,36138元/O,420万
天津,荔湾公寓 4室2厅 181.14平,4室2厅|181.14O|低层（共7层）|东南向|2006年建|袁欣,荔湾公寓越秀路-前进道102号,28983元/O,525万
天津,英里 3室2厅 124.14平,3室2厅|124.14O|中层（共7层）|南北向|2020年建|高明士,艺英里李七庄-秀川路津宴大酒楼东50米艺英里,19010元/O,236万
天津,朗庭园 135.83平3居 南北向中装修 随时签约,3室2厅|135.83O|中层（共11层）|南北向|2014年建|高明士,朗庭园李七庄-西青区昌凌路与丽江道交口北侧300米,24663元/O,335万
天津,金厦新都庄园涵溪园 3室2厅 121.85平,3室2厅|121.85O|高层（共6层）|南北向|2006年建|高明士,金厦新都涵溪园李七庄-西青区雅乐道与香霞路交口东南角,14936元/O,182万
天津,金厦新都庄园涵溪园 1室1厅 60.22平,1室1厅|60.22O|低层（共6层）|南向|2006年建|高明士,金厦新都涵溪园李七庄-西青区雅乐道与香霞路交口东南角,19096元/O,115万
天津,中介-费①个点 钻石湾 新上三居 诚意出售 采光可以,3室2厅|141.51O|低层（共53层）|西向|2017年建|郭t健,中海城市广场钻石湾大王庄-海河东路与九经路交口西南侧,31446元/O,445万
天津,正南富力津门湖云舒花园2室1厅精装修,2室1厅|90.74O|底层（共26层）|南向|2008年建|梁星星,富力津门湖云舒花园李七庄-河西紫金山路与珠江道交口西侧,25126元/O,228万
天津,"和平3片,四平东道,落沪好房, 价合适 ,可公易贷",1室0厅|17.25O|低层（共3层）|东南向|2018年建|胡博,哈密道劝业场街-(和平)哈密道,72463元/O,125万
天津,红橡三期三室两卫位置好看房随时房主诚心急售捡漏随时看,3室2厅|125O|高层（共23层）|南北向|2017年建|朱显晶,宜禾红橡公园二期美锦中新生态城-中新生态城和顺路与和畅路交口,15840元/O,198万
天津,中.介.费①个点 商品房 低楼层 采光好 无遮挡 诚意出售,2室1厅|78.53O|底层（共6层）|西南向|2017年建|孙旺,新义信里大王庄-北长路与八经路交口西侧,19737元/O,155万
天津,昆明路有坐位 南北通透 价格全包 随时看房,2室1厅|36.63O|顶层（共6层）|南北向|2017年建|胡博,四达里新兴街-昆明路与沙市道交口南侧,73710元/O,270万
天津,昆明路有座 6楼南北通透 公产可贷款 无后期费用价格全包,2室1厅|47.34O|顶层（共6层）|东西向|2018年建|胡博,金泉里新兴街-吴家窑一号路与河沿道交叉路口向东北约100米,57245元/O,271万
天津,万科东第 3室2厅 123.09平,3室2厅|123.09O|中层（共10层）|南北向|2006年建|高明士,万科东第李七庄-卫津南路西侧中医一附院(南院)旁,33715元/O,415万
天津,生态城 博与海 精装交房 单价低 低密度 目送式单价8K靠谱,3室2厅|108O|底层（共7层）|南北向|2018年建|李爱军,博屿海中新生态城-生态城北区中新大道与中海大道交汇,8148元/O,88万
天津,碧波园 3室1厅2卫 其它 448万元 162.8平米,3室1厅|162.9O|中层（共6层）|南向|2017年建|郭t健,碧波园大直沽-五号路18-1号,27501元/O,448万
天津,金厦新都庄园静溪园 2室2厅 92.59平,2室2厅|92.59O|高层（共6层）|南北向|2006年建|高明士,金厦新都庄园李七庄-卫津南路与津涞公路交口,18360元/O,170万
天津,合景精装3室一楼带大概50平米大院 精装修 满五.,3室1厅|109.83O|底层（共11层）|南北向|2017年建|李明文,合景御华园双港镇-双港镇津港高速辅路与景荔道交口,22762元/O,250万
天津,凯立天香家园 五马路 3楼 双阳南北通透 着急卖价格好谈,2室1厅|91.24O|中层（共6层）|南北向|2017年建|杨翠萍,凯立天香家园广开街-长江道66号(长江道与青年路交口),39237元/O,358万
天津,"总监推荐!南北通透 H户型全明,不临街,五 马路校片",2室1厅|101.67O|中层（共6层）|南北向|2017年建|杨翠萍,凯立天香家园广开街-长江道66号(长江道与青年路交口),40326元/O,410万
天津,"带电梯 南北通透 三室已改大两室,一层两户采光充足。",3室2厅|143.74O|中层（共11层）|南北向|2018年建|杨翠萍,广林园广开街-天津市南开区广开四马路115号交叉路黄河道口,27828元/O,400万
天津,中芥1%宇正园 房龄新 电梯洋房 出门地铁站 九年一贯制,2室1厅|111.36O|中层（共11层）|南向|2017年建|邢滨书,宇正园广开街-黄河道146号,38882元/O,433万
天津,生态城 枫书园 北师大对面 新房没住过 有W籍车位 诚心卖,3室2厅|140O|中层（共8层）|南北向|2017年建|朱显晶,中加生态示范区中新生态城-中新生态城滨海旅游区海洋博物馆西南侧,14357元/O,201万
天津,生态城万科锦庐一楼带大院希缺房源房主诚心出售非诚勿扰,3室2厅|143O|底层（共5层）|南北向|2017年建|朱显晶,万科锦庐中新生态城-万科锦庐,20979元/O,300万
天津,中发里 2室2厅 91.87平,2室2厅|91.87O|中层（共7层）|南北向|2006年建|高明士,中发里李七庄-杨楼津莱公路与香霞路交口南侧300米,15021元/O,138万
天津,亲民存房拥金1 南开区五马路 3室不到顶 近地铁 急售随时看,3室2厅|140.03O|顶层（共6层）|南向|2017年建|蒋智慧,凯兴天宝公寓广开街-南开区广开四马路与天宝路交口,30350元/O,425万
天津,"首创香堤苑,洋房三室,看房方便,出房率高",3室2厅|122.29O|高层（共6层）|南向|2017年建|李明文,首创香堤苑双港镇-梨双公路与微山南路交口南侧,21260元/O,260万
天津,远洋万和府生态城起步区一社区旁纯洋房社区低密宜居精装交房,3室2厅|108O|高层（共7层）|南北向|2017年建|朱显晶,远洋万和府中新生态城-中新生态城中天大道与和睦路交口,16666元/O,180万
天津,"和平三片,直管公产面积过10,价格全包 可公易贷",1室0厅|19.51O|低层（共3层）|东南向|2018年建|胡博,和平区兴安路小白楼街-(和平)兴安路,65607元/O,128万
天津,王串场萃华里 中环内 2楼 大两室 公可买产权 随时看房,2室1厅|65O|低层（共7层）|东向|1995年建|姚芳,萃华里王串场-王串场六号路与真理道交口西北角处,12153元/O,79万
天津,王串场 2楼两室 适合改善 面积足 全包价格 随时看房,2室1厅|46.31O|低层（共7层）|东向|2017年建|姚芳,萃华里王串场-王串场六号路与真理道交口西北角处,17058元/O,79万
天津,十二经路13 可贷款 集体户口可买 看房方便,2室1厅|60O|中层（共6层）|南北向|2010年建|仲麒,十二经路13号院大王庄-十二经路13号,13000元/O,78万
天津,中介M1% 兴云里 南北通透 电梯洋房 有钥匙 急急急急,2室1厅|84.67O|中层（共7层）|南北向|2006年建|孟令伟,兴云里广开街-西营门大街9号,30707元/O,260万
天津,南北通透玉水园1室1厅,1室1厅|73.31O|高层（共6层）|南北向|2002年建|梁星星,玉水园梅江-友谊南路与郁江道交口西南角,29327元/O,215万
天津,"首创禧瑞府157户型小高层,2梯2户,小区环境好实景宋氏园林",4室2厅|157O|底层（共14层）|南北向|2023年建|刘占元,龙湖首创禧瑞郦城中北镇-中北镇阜锦道与金霞路交口西北侧,21019元/O,330万
天津,和平3片 西康路小W 3楼双阳面两室 免拥金 可公易贷落户,2室1厅|58O|中层（共6层）|南北向|胡博,和平区迎春里新兴街-西康道与宜昌路交口,37758元/O,219万
天津,中介M1% 云栖里 私产房可贷款 业主诚心出售 中心W片,1室1厅|35.77O|高层（共6层）|南向|2006年建|孟令伟,云栖里万兴街-鞍山西道258号,36063元/O,129万
天津,生态城 精装三室 准现房 地铁旁 随时看房 找我有优惠,3室2厅|95O|底层（共8层）|南北向|2023年建|李爱军,中核智慧城中新生态城-中新天津生态城中央大道与玉砂道交口,9473元/O,90万
天津,近南开 地铁站旁 五米开间宽厅大落地窗 电梯洋房,3室3厅|114O|低层（共11层）|南北向|2018年建|赵雪,艺英里李七庄-秀川路津宴大酒楼东50米艺英里,16666元/O,190万
天津,万全道阳面三室 中间楼层视野采光佳,3室1厅|95.97O|中层（共30层）|东南向|2017年建|李凤超,新文化花园新景居南市-和平区多伦道与荣业大街交口西侧,49494元/O,475万
天津,距离南开不到两公里 地铁600米 五米开间大宽厅落地窗,3室2厅|114O|低层（共11层）|南北向|赵雪,艺华里李七庄-友谊南路111号永旺梦乐城F3,16666元/O,190万
天津,"和平吉星南里南北两居室 不临街,采光好",2室1厅|35.41O|底层（共5层）|南北向|2018年建|李凤超,吉星南里南营门-昆明路46号,88957元/O,315万
天津,"风荷园标准H户型,精装修,采光好,一层两户,无遮挡",2室2厅|134.1O|高层（共6层）|东西向|2017年建|侯志超,风荷园万兴街-西湖道与白堤路交口西侧,21252元/O,285万
天津,【亲民存房拥金1】英俊名邸 南北通透两居室 私产满五诚意,2室1厅|108.86O|高层（共30层）|南北向|2017年建|蒋智慧,英俊名邸万兴街-孤山路16号,28476元/O,310万
天津,中间楼层 阳面两室 私产过五年 居住陪读 诚意出售,2室1厅|72.42O|中层（共6层）|南向|2018年建|韩博宇,鸿记里劝业场街-和平区锦州道与河北路交口,53162元/O,385万
天津,"吉星南里 双阳户型,采光好,敞亮,产权清晰",2室1厅|66.39O|中层（共5层）|南向|2018年建|李凤超,吉星南里南营门-昆明路46号,55731元/O,370万
天津,"此房满二,南北通透全明户型,大房本,可以贷款",2室2厅|106.66O|低层（共21层）|南北向|2017年建|李明文,津南仁和园双港镇-津南区双港镇梨双公路,9844元/O,105万
天津,生态城 精装修洋房 通透两室 紧邻教育资源 商业 配套齐全,2室1厅|87.57O|中层（共7层）|南北向|2018年建|陈浩,红星天铂湾中新生态城-中新天津生态城海博道与永盛路交口,15416元/O,135万
天津,"拥津1c 凯兴天宝 南北通透中楼层,H户型大两居,诚心卖房",2室1厅|110.16O|中层（共6层）|南北向|2017年建|王鸿,凯兴天宝公寓广开街-南开区广开四马路与天宝路交口,35039元/O,386万
天津,真诚如您所见 翠亨村高层精装一居室01户型74平米175万,1室1厅|74.01O|高层（共28层）|东北向|1998年建|唐珂青,翠亨村第三大街-经济技术开发区第三大街与巢湖路交口北侧,23645元/O,175万
天津,和平一片 哈密道小W 产权清晰 独立厨卫 总价低,1室1厅|10.4O|顶层（共2层）|南向|于万丽,河沿路16号新兴街-吴家窑大街与气象台路交口,100961元/O,105万
天津,振河里 2室1厅1卫 精装 332万元 61.1平米,2室1厅|61.27O|中层（共7层）|南向|2017年建|李凤超,振河里新兴街-气象台路与同安道交口西南角处,54186元/O,332万
天津,买房子可以直接口了万科滨江都会 南北向精装修 视野无遮挡,2室1厅|76O|中层（共17层）|南北向|2017年建|李美霞,万科滨江都会响螺湾-迎宾大道与坨场道交口南100米,12500元/O,95万
天津,双港红|领世郡 通透两室 新装修没住过 拎包入住,2室1厅|84.08O|中层（共18层）|南向|2017年建|李明文,红|领世郡双港镇-友谊南路111号天津永旺购物中心F3,12107元/O,101.8万
天津,"亲民中介拥金1海光寺电梯房交通便利,出行方便,居住方便舒适.",3室2厅|131.64O|低层（共13层）|东西向|2017年建|蒋智慧,龙德里万兴街-万德庄大街与万德庄南北街交口西侧,20890元/O,275万
天津,满五 (97平加7平 精装)标准H加1户型 地铁公园在侧,3室2厅|95.74O|高层（共18层）|南北向|2014年建|栾健锋,金地艺华年双港镇-金地艺华年,15354元/O,147万
天津,中介M1% 兴云里 南北通透两室 电梯洋房 私产满五年,2室1厅|84.67O|中层（共7层）|南北向|2006年建|孟令伟,兴云里广开街-西营门大街9号,30707元/O,260万
天津,生态城起步区园)精装准现房 品质小区配套完善 人车分流 收藏,2室2厅|83O|底层（共6层）|南向|2006年建|王飞,和溪园中新生态城-和溪园,15060元/O,125万
天津,中新生态城 刚需两居 临地铁 出行方便,2室2厅|88.62O|低层（共18层）|南向|2012年建|陈浩,碧桂园滨海城中新生态城-天津市中新生态城中央大道与海博路交口,11058元/O,98万
天津,南北通透华夏津典泉水园3室2厅,3室2厅|171.4O|高层（共11层）|南北向|2004年建|齐忠将,华夏津典泉水园梅江-友谊南路和左江道交口东南侧,33547元/O,575万
城市,标题,房源信息描述,房源位置信息,单价,房总款
天津,"亲民中介拥金1海光寺电梯房交通便利,出行方便,居住方便舒适.",3室2厅|131.64O|低层（共13层）|东西向|2017年建|蒋智慧,龙德里万兴街-万德庄大街与万德庄南北街交口西侧,20890元/O,275万
