城市,标题,房源信息描述,房源位置信息,单价,房总款
天津,远洋城 香颂园 洋房现代风落地大窗带子母车位等有缘人,3室2厅|158O|低层（共15层）|南北向|2016年建|闫景宾,香颂园胡家园-胡家园津塘公路段(华北陶瓷对面),11708元/O,185万
天津,中・・介・・费1・・个・・点咸阳路58号内 3室72.34平,3室1厅|72.34O|底层（共5层）|南北向|2006年建|翟海洋,海洋住宅小区向阳路-咸阳路58号咸阳路与黄河道交口,38567元/O,279万
天津,23年底交房 海教园金科四季春晓 南开九年制 地铁六号线,3室2厅|101O|顶层（共7层）|南北向|2017年建|李明文,四季春晓海河教育园-嘉明路与雅馨路交口,15643元/O,158万
天津,"小三居,楼位好,好楼层,有房本 满两年",3室1厅|84.64O|低层（共18层）|南北向|2017年建|马立栋,景瑞・誉Z天地张家窝-华苑科技园华科大街与内环二路交口处,18076元/O,153万
天津,南开中心小W 私产可贷款 一层4户 诚意出售,1室1厅|37.45O|高层（共6层）|东向|1987年建|术勇强,龙凤里兴南街-兴南街22号,33377元/O,125万
天津,"拥+金+1%++++带电梯私产过五年精装修地铁边,97年房龄",1室1厅|48.82O|中层（共22层）|南向|2017年建|李梦龙,龙都花园挂甲寺-河西区大沽南路与利民道交口东北侧,35026元/O,171万
天津,南开北 咸阳路 南北通透 采光充足 户型方正 配套齐全,3室1厅|48.32O|高层（共6层）|南北向|2018年建|张庆霞,雅园里长虹街-芥园西道与咸阳路交口东南侧,30008元/O,145万
天津,新房免拥金天津站摩天轮 河北区昆一 准现 精装 和融广场,2室1厅|85.76O|中层（共32层）|西南向|2022年建|翟海洋,和融广场光复道-胜利路与兴隆街交口,23320元/O,200万
天津,三潭东里精装修 南开 3楼 完整一居室,1室1厅|21.35O|中层（共7层）|北向|2021年建|李冰华,三潭东里万兴街-南开区鞍山西道与三潭路交口东北角,26229元/O,56万
天津,仁恒公园世纪 127.13平3居 南向精装修 拎包入住,3室2厅|127.13O|高层（共28层）|南向|2022年建|陈红,仁恒公园世纪梅江-浯水道与洞庭路交口,37756元/O,480万
天津,富力津门湖江湾广场 89.09平2居 南北向精装修 方便看房,2室2厅|89.09O|中层（共31层）|南北向|2007年建|陈红,富力津门湖江湾广场李七庄-紫金山路与珠江道交口西侧,21887元/O,195万
天津,海逸长洲瀚景园 127平3居 南北向简装修 视野无遮挡,3室2厅|127O|低层（共26层）|南北向|2008年建|陈红,海逸长洲瀚景园梅江-友谊南路与绥江道交口西侧,29133元/O,370万
天津,"【拥金1】此房满五年,南北向,配套齐全,交通方便,出房率高",3室1厅|146.43O|高层（共13层）|南北向|2018年建|王利华,宇正园广开街-黄河道146号,34146元/O,500万
天津,保利和光尘樾 宽厅结构 房型好 位置棒 楼层好,3室1厅|114.01O|中层（共18层）|南北向|2017年建|马立栋,保利和光尘樾张家窝-精武镇才智道与学府东路交叉口西南,16752元/O,191万
天津,"拥金1,南北三居、带车位。精装修、产权清晰随时过户。",3室2厅|124.9O|低层（共25层）|南北向|2017年建|杨涛,亿城水畔花园长虹街-津河南路与红旗路交口东南侧,34427元/O,430万
天津,"品质洋房,精装修,全屋定制,随时看房",3室2厅|109.18O|底层（共7层）|南北向|2018年建|张清宇,景瑞翰邻海河教育园-泰明路与雅馨路交口东南侧。,25554元/O,279万
天津,"环内电梯洋房,一楼带院30O, 即买即住,随时看房",3室2厅|127O|底层（共6层）|南北向|2022年建|李明文,财信河西府双港镇-浯水道与学苑路交口,26850元/O,341万
天津,南江西里 3楼阳面一室 采光好 有钥匙随时看房,1室1厅|37.75O|中层（共5层）|南向|2017年建|张庆霞,南江西里嘉陵道-云阳道与南江路交口西南侧,22516元/O,85万
天津,中・・介・・费1・・个・・点!红|公寓 2室 89.57平,2室1厅|89.57O|高层（共18层）|南北向|2006年建|翟海洋,红|公寓万兴街-西湖村大街19号,27017元/O,242万
天津,"!!直管公产,能买产权,低楼层南北向采光好",2室1厅|37.7O|中层（共5层）|南北向|2017年建|马伟丛,东风里向阳街-向阳西支路11号,50397元/O,190万
天津,拥金1 汇福华庭次顶!我是维护人知道底价! 南北通透H户型!,2室1厅|108.65O|顶层（共9层）|南向|2017年建|沈广升,汇福华庭兴南街-南门外大街与南开二马路交口,47768元/O,519万
天津,昆明路 低楼层 有钥匙 看房方便,1室1厅|19.05O|低层（共6层）|北向|2017年建|张静,四达里新兴街-昆明路与沙市道交口南侧,139107元/O,265万
天津,金德园 阳面两居 房龄新 地段好 户型方正电梯,2室1厅|86.86O|低层（共30层）|南向|2017年建|张静,金德园南营门-贵阳路79号,73681元/O,640万
天津,金侨新梅江壹号 103.42平4居 南北向精装修 视野无遮挡,4室3厅|103.42O|顶层（共28层）|南北向|2015年建|陈红,金侨新梅江壹号梅江-解放南路东侧新梅江卫津河公园与太湖路公园旁,53181元/O,550万
天津,洋房中间楼层 小三室格局方正 封闭式小区,3室2厅|104.4O|中层（共8层）|南北向|2017年建|杨继金,众美青城中新生态城-中新生态城中天大道与和顺路交口,13601元/O,142万
天津,风湖里 引滦院 精装三室 拎包入住 全天沐浴阳光,3室1厅|107.4O|高层（共24层）|南北向|2017年建|张庆霞,风湖里学府街-鞍山西道307号,23463元/O,252万
天津,急售急售 南开中片 中间楼层 长宁里 不到顶 总价低 有钥匙,1室1厅|16.6O|中层（共5层）|北向|2018年建|邱红梅,长宁里万兴街-南开区长江道与孤山路交口南侧100米,23493元/O,39万
天津,河西区麦李园 精装大3居 配套齐全 中间楼层,3室2厅|144.47O|低层（共18层）|南北向|2017年建|汤静静,全运村麦李园东海街-洞庭路与渌水道交口,37378元/O,540万
天津,南开南片高档社区 现房现房!!!3号线地铁上盖 3室2厅2卫,3室2厅|101.04O|中层（共26层）|南北向|2023年建|沈广升,保利云禧王顶堤-迎水道99号,37114元/O,375万
天津,卡梅尔天淳园 263.21平4居 南北向精装修 视野无遮挡,4室2厅|263.21O|底层（共3层）|南北向|2006年建|陈红,卡梅尔天淳园梅江-梅江南居住区环岛东路西侧,56228元/O,1480万
天津,海逸长洲瀚波园 270.03平4居 南北向简装修 自住保养好,4室3厅|270.03O|高层（共22层）|南北向|2011年建|陈红,海逸长洲瀚波园李七庄-友谊南路与绥江道交口西侧,34366元/O,928万
天津,凤园南里 1室1厅1卫 其它 39.5万元 20平米,1室1厅|20.19O|高层（共7层）|东向|2018年建|邱红梅,凤园南里王顶堤-苑东路73号,19564元/O,39.5万
天津,御澜名邸南婚房 仅售80.00万,2室2厅|85.84O|高层（共18层）|南向|2014年建|杨继金,御澜名邸北塘-镜泊湖路653号,9319元/O,80万
天津,新悦亭 独栋别墅 有大院子 毛坯 看房随时维护人,4室3厅|415.33O|底层（共2层）|东南向|2017年建|李明文,红|领世郡双港镇-友谊南路111号天津永旺购物中心F3,22873元/O,950万
天津,"河西区金海湾花园,精装H户型,商品房,改善型住房",2室1厅|96.75O|中层（共6层）|南北向|2018年建|李鑫磊,金海湾花园陈塘庄-大沽南路1069号(大沽南路与学苑路交口),27390元/O,265万
天津,双D铁(落籼旖蚝佣四片)45万 正式一室(无中阶M和税),1室1厅|25.05O|低层（共6层）|南向|1997年建|张擎,益寿东里常州道-河东区常州道与泰兴路交口西南角处,17964元/O,45万
天津,拥+金+1%++++满五 省个税 户型方正 业主诚意出售,1室1厅|39.25O|高层（共8层）|西向|2017年建|李梦龙,景兴西里挂甲寺-河西区利民道与大沽路交口西北侧,36687元/O,144万
天津,南北通透瑞江花园兰苑2室1厅,2室1厅|97.22O|底层（共6层）|南北向|2007年建|郑玉帅,瑞江花园兰苑瑞江-河西区解放南路与珠江道交口西北角,31680元/O,308万
天津,90多万就卖 价格太合适了 正南 富力桃园 2室1厅 精装修,2室1厅|90.17O|顶层（共27层）|南向|2009年建|刘文斌,富力桃园双港镇-天津市津南区赤龙街与微山路交口西南角,12199元/O,110万
天津,免拥金 稀缺平房 咸阳路小W 规划可能 赠送一间屋 有钥匙,1室0厅|30O|底层（共1层）|南向|1980年建|术勇强,雅园里长虹街-芥园西道与咸阳路交口东南侧,23333元/O,70万
天津,全运村棣棠园 3室1厅 精装修 房主诚心出售 价可议 有车位,3室1厅|98.47O|低层（共26层）|南北向|2017年建|张丽娜,全运村棣棠园东海街-洞庭路与渌水道交口,37574元/O,370万
天津,"河西一片 友谊公寓,四室,中楼层,南北通透,诚意出售",4室1厅|162.06O|中层（共7层）|南北向|2018年建|李鑫磊,友谊公寓越秀路-黄埔南路55号,32703元/O,530万
天津,"中交海河公馆 1室1厅 53.71平 刚交房,诚意出售,",1室1厅|53.71O|低层（共28层）|东北向|2006年建|宋宝静,中交海河公馆鼓楼街-东马路与北马路交口西南角,44312元/O,238万
天津,"户型格局好,近地铁,精装修,可拎包入住",3室2厅|110.81O|底层（共6层）|南北向|2017年建|张清宇,景瑞翰邻海河教育园-泰明路与雅馨路交口东南侧。,25087元/O,278万
天津,"清枫园,精装一室,南北通风,楼层适中诚心出售",1室1厅|69.18O|中层（共18层）|南北向|2017年建|程伟,大地十二城清枫园中北镇-新津杨公路西行500米,14744元/O,102万
城市,标题,房源信息描述,房源位置信息,单价,房总款
天津,四达里 2室1厅1卫 精装 327万元 34.83平米,2室1厅|35.06O|顶层（共6层）|南北向|2018年建|张静,四达里新兴街-昆明路与沙市道交口南侧,93268元/O,327万
天津,新梅江雅境新枫尚 75.65平2居 南北向精装修 方便看房,2室1厅|75.65O|低层（共27层）|南北向|2008年建|陈红,新梅江雅境新枫尚梅江-解放南路与渌水道交口东南侧,30270元/O,229万
天津,"吉宝季景兰庭核心地段,核心位置,无税房,诚意出售 !!",2室2厅|88O|中层（共17层）|南北向|2017年建|杨继金,吉宝季景兰庭中新生态城-吉宝季景兰庭,12272元/O,108万
天津,"总监推荐新都花园 格局方正,南北通透 模范小区精装修",2室2厅|113.58O|高层（共10层）|南北向|2017年建|王惠彬,新都花园万兴街-万德庄大街43号,44021元/O,500万
天津,天津瑞府+新交房精装3室+业主诚意出售+上学居住两不误,3室2厅|104.48O|低层（共31层）|南北向|2017年建|汤静静,城投华润天津瑞府梅江-洞庭路与太湖路交口,35222元/O,368万
天津,全新装修 家具家电全送 小区仅此一套 首付不到20万 拎包住,2室1厅|84O|中层（共18层）|南北向|刘文斌,"红|领世郡领世深白双港镇-领世郡版块内,领世环路与领世路交口",10119元/O,85万
天津,真诚里 公产 昆一片 三拆(无中介M和税)全包价,1室0厅|13.83O|底层（共3层）|南向|1956年建|张擎,真诚里王串场-河北区王串场一号路与真理道交口,33261元/O,46万
天津,亲民中介拥金1宁祥里一楼带大院四室南北通透出门水上公园 养老,4室1厅|111.38O|底层（共6层）|南北向|2017年建|蒋智慧,宁祥里八里台-水上东路与士英路交口,30077元/O,335万
天津,南开北片 九年一惯制W区 可转南开 户型齐全 南北通透,3室2厅|98.47O|中层（共26层）|南北向|2020年建|王子士,南开1911向阳路-黄河道与红日路交口启迪协信营销中心,36965元/O,364万
天津,岳阳陪读电梯房 精装40万点击我头像店铺有300套选,3室1厅|93.66O|低层（共24层）|东南向|2017年建|田娜,三乐里新兴街-汉口西道8号,41639元/O,390万
天津,领世郡18号地纯洋房带阁楼露台有装修满五年南北通透,3室1厅|107.05O|高层（共5层）|南北向|2017年建|李明文,红|领世郡常春藤双港镇-解放南路与外环线交口以东两公里,16814元/O,180万
天津,景兴西里两室 南北通透 私产过五年 业主诚售,2室1厅|54.07O|顶层（共7层）|南北向|2017年建|马伟丛,景兴西里挂甲寺-河西区利民道与大沽路交口西北侧,32365元/O,175万
天津,河南路 和平1片劝业场 直管公产独用面积12O 随时看房,1室0厅|16.66O|顶层（共3层）|南向|2006年建|王子龙,春星里劝业场街-沈阳道58号,78031元/O,130万
天津,过五年 产权清晰 南北通透 好户型 楼层好 房龄新,2室1厅|97.9O|中层（共6层）|南北向|2017年建|王惠彬,金宇里天拖-楚雄道39号,30643元/O,300万
天津,"天津全运村棣棠园99平小户型,刚需",3室2厅|98.79O|中层（共24层）|南北向|2017年建|张丽娜,天津全运村东海街-洞庭路与渌水道交口,38971元/O,385万
天津,南北通透 梅江康城 2室2厅 精装修,2室2厅|88.22O|顶层（共23层）|南北向|2009年建|陈红,梅江康城大寺-友谊南路与外环线交口以南200米处,14509元/O,128万
天津,南北通透 红|领世郡常春藤 2室2厅 精装修,2室2厅|100.9O|高层（共5层）|南北向|2010年建|张丽花,红|领世郡常春藤双港镇-解放南路与外环线交口以东两公里,19821元/O,200万
天津,海天尚景园全明两室08年商品房 采光充足精装修,2室2厅|110.05O|中层（共23层）|南北向|2017年建|马伟丛,海天尚景越秀路-广东路与利民道交口西北侧,42253元/O,465万
天津,"新星片,两室,产权清晰,双阳户型,随时看房",2室1厅|63.21O|中层（共5层）|南向|2018年建|张寰,竞业里南营门-和平区昆明路与营口道交口西侧,56953元/O,360万
天津,拥金1 雅安西里 双阳3楼精装修 诚意出售,2室1厅|57.97O|中层（共6层）|南北向|2006年建|尹倩,雅安西里嘉陵道-南开区雅安道6号,23287元/O,135万
天津,中芥1% 飞云东里 2室1厅 70.56平,2室1厅|70.56O|低层（共6层）|南北向|2006年建|赵大地,飞云东里万兴街-飞云道30号,28061元/O,198万
天津,纯雅二期 全阳三室 环境优雅 业主诚意卖,3室2厅|122O|中层（共6层）|南北向|2018年建|李鑫磊,纯雅公寓友谊路-纯正路28号,26229元/O,320万
天津,华亭丽园 1室1厅1卫 精装 106万元 70.81平米,1室1厅|71O|底层（共21层）|南向|2017年建|程伟,华亭丽园中北镇-中北镇镇政府西侧,14929元/O,106万
天津,金侨新梅江壹号 104.29平3居+南北向精装修+着急出售,3室2厅|104.29O|高层（共26层）|南北向|2015年建|汤静静,金侨新梅江壹号梅江-解放南路东侧新梅江卫津河公园与太湖路公园旁,35477元/O,370万
天津,"两室,中间楼层,私产可贷款,采光,不把边。",2室1厅|54.73O|中层（共6层）|南向|2018年建|李鑫磊,"谊景村友谊路-平江南道22号,越秀路与平江道交口",38370元/O,210万
天津,云锦世家 三期洋房 三室两卫 单价1万9的洋房来了,3室1厅|119.84O|高层（共9层）|南北向|2017年建|程伟,锦世家中北镇-星光路西侧,19359元/O,232万
天津,拥津1c 春丰园 精装修 次新房 地铁双线 交通便利,3室2厅|97.83O|中层（共24层）|东南向|2017年建|王鸿,春丰园天拖-天拖北道春丰园,37820元/O,370万
天津,中.介.费共①个点 此房南北通透 不临街 采光充足 没有高层,2室1厅|62.38O|高层（共6层）|南北向|2018年建|薛维,稚优里八里台-迎水道10号,19076元/O,119万
天津,景瑞誉景天地 通透三室双卫 次新房 小外片,3室2厅|98.36O|顶层（共18层）|南北向|2017年建|马立栋,景瑞・誉Z天地张家窝-华苑科技园华科大街与内环二路交口处,16470元/O,162万
天津,雅居乐御宾府 90平3居 南北向简装修 视野无遮挡,3室1厅|90O|底层（共7层）|南北向|2019年建|陈红,雅居乐御宾府海河教育园-雅润路与泰明路交口,20977元/O,188.8万
天津,南北通透世纪梧桐公寓1室1厅精装修,1室1厅|85.47O|顶层（共25层）|南北向|2015年建|王啸,世纪梧桐公寓梅江-天津市河西区珠江道与九连山路交口以东200米,27495元/O,235万
天津,"此房源三室两厅直通地库,业主诚心出售,看房方便。",3室2厅|110.1O|低层（共7层）|南北向|2018年建|郝经国,锦绣大家海河教育园-海河教育园区和慧南路与同心路交口东南侧,18165元/O,200万
天津,中・・介・・费1・・个・・点 天大北五村 3室 77.48平,3室1厅|77.48O|底层（共4层）|南北向|2006年建|翟海洋,天大北五村万兴街-鞍山西道与卫津路交口西北角,45431元/O,352万
天津,南北通透 富力桃园 3室2厅 高楼层 采光好 出国急售,3室2厅|127.47O|高层（共28层）|南北向|2009年建|刘文斌,富力桃园双港镇-天津市津南区赤龙街与微山路交口西南角,14670元/O,187万
天津,南江西里 3楼阳面一室 采光好 有钥匙随时看房,1室1厅|37.75O|中层（共5层）|南向|2017年建|张庆霞,南江西里嘉陵道-云阳道与南江路交口西南侧,22516元/O,85万
天津,新梅江 天空之境 没住过人 169户型 有钥匙 喜欢进来看,3室2厅|169.48O|低层（共16层）|南北向|2018年建|汤静静,中海天空之镜梅江-太湖路与梦湖西道交口,44253元/O,750万
天津,惠众家园 69.83平2居 南北向简装修 安静不临街,2室1厅|69.83O|低层（共29层）|南北向|2008年建|陈红,惠众家园东海街-微山路与渌水道交叉口西北侧,19619元/O,137万
天津,逸阳 旁 年底交房 看房可享优惠价格 低密洋房社区,3室2厅|145O|底层（共6层）|南北向|2006年建|田绍强,天保九如品筑军粮城镇-空港经济区经一路和纬二道交口,20413元/O,296万
天津,南北通透卡梅尔天淳园3室3厅精装修,3室3厅|174.51O|高层（共26层）|南北向|1999年建|胡绍臣,卡梅尔天淳园梅江-梅江南居住区环岛东路西侧,27849元/O,486万
天津,龙德里 2室1厅 114.87平 1999年电梯房 海光寺片,2室1厅|114.87O|中层（共13层）|东向|2006年建|宋宝静,龙德里万兴街-万德庄大街与万德庄南北街交口西侧,23678元/O,272万
天津,"起步区,远洋万和府洋房。精装修",3室2厅|130.01O|低层（共7层）|南北向|2018年建|渠志宇,远洋万和府中新生态城-中新生态城中天大道与和睦路交口,22690元/O,295万
天津,"金海湾花园有电梯H+1户型南北通透格局好采光无遮挡,双",3室2厅|158.8O|低层（共11层）|南北向|2018年建|李鑫磊,金海湾花园陈塘庄-大沽南路1069号(大沽南路与学苑路交口),30856元/O,490万
天津,南北通透万科水晶城香溪园4室2厅精装修,4室2厅|186.32O|顶层（共4层）|南北向|2000年建|孙迎,万科水晶城香溪园梅江-解放南路518号,27318元/O,509万
天津,金山里 两居室 满五 南北通透 采光充通便利,2室1厅|57.16O|高层（共5层）|南北向|2018年建|张寰,金山里马场街-紫金山路与气象台路交口,27116元/O,155万
天津,复式精装修 全明户型 独门独户 拎包入住带电梯 双地铁,2室2厅|46.84O|中层（共33层）|北向|2017年建|岳强,诚基经贸中心体育馆街-和平区南京路与山西路交口,77924元/O,365万
天津,落跆旖蚴星(五天拿房本)无中介M13672O55OO4,1室1厅|37O|低层（共6层）|西南向|1997年建|张擎,冠云西里东新街-万新村天山路与崂山道交口,13243元/O,49万
天津,"泰悦豪庭,湘江道 全阳两室 绿城品质物业",2室2厅|121.18O|低层（共28层）|南向|2017年建|马伟丛,泰悦豪庭下瓦房-琼州道19号,49513元/O,600万
天津,南北通透半岛豪庭天潇园3室2厅,3室2厅|156.69O|高层（共9层）|南北向|2004年建|王路路,半岛豪庭天潇园梅江-河西区友谊南路与环岛北路交口,33505元/O,525万
天津,金海湾花园 双阳通透B户型 两室可改三室 中间楼层私产随时看,2室1厅|75.37O|中层（共6层）|南北向|2018年建|李鑫磊,金海湾花园陈塘庄-大沽南路1069号(大沽南路与学苑路交口),29852元/O,225万
天津,南北通透 全运村流苏园 3室2厅 精装修,3室2厅|143.83O|高层（共17层）|南北向|2017年建|汤静静,全运村流苏园东海街-洞庭路与渌水道交口,38656元/O,556万
天津,远洋万和城 93.19平2居 南向简装修 着急出售,2室1厅|93.19O|中层（共26层）|南向|2008年建|陈红,远洋万和城大寺-友谊南路与梨双路交口以东500米,16632元/O,155万
天津,新景园大2室可改3室 首付20万左右就能拥有 精装修拎包住,2室2厅|88O|高层（共18层）|南北向|刘文斌,新景园双港镇-睿泽道天津津南开发区,10227元/O,90万
天津,中海 全明通透格局 中间楼层 满足全天采光 下楼即是和,3室2厅|109.9O|高层（共29层）|南北向|2018年建|李鑫磊,中海寰宇天下陈塘庄-洞庭路与黑牛城道交口,38216元/O,420万
天津,富力城天康园 婚房两居室 小区前排采光好,2室1厅|89.05O|中层（共32层）|南北向|2018年建|张毅秀,富力城天康园鼓楼街-北马路与西马路交口东南角,53902元/O,480万
天津,名都新园 稀缺跃层户型 使用面积200平米 房主诚心出售,3室2厅|158O|高层（共6层）|南北向|2000年建|张丽娜,名都新园尖山街-解放南路与珠江道交口,21202元/O,335万
天津,紫金南里 个人产权 全装,1室1厅|39.93O|高层（共5层）|南北向|张寰,紫金南里天塔街-紫金山路与环湖中道交口南侧,33057元/O,132万
天津,泉水园 新出好房 精装修 电梯洋房 三居室,3室2厅|166.53O|顶层（共8层）|南北向|2017年建|汤静静,华夏津典泉水园梅江-友谊南路和左江道交口东南侧,35969元/O,599万
天津,中・・介・・费1・・个・・点 不临街红|花园 2室,2室2厅|122.25O|中层（共6层）|南北向|2006年建|翟海洋,红|花园万兴街-南开区万德庄大街与万德庄南北街交口西北侧,32883元/O,402万
天津,中海招商十里观澜 3室2厅2卫 毛坯 480万元,3室2厅|143.09O|中层（共25层）|南向|2023年建|刘文贝,中海招商十里观澜新开河-天泰路与富运道交口,33545元/O,480万
天津,爱情缤纷里现房 即买即住 中间楼层 总价低 3号线,2室2厅|73.92O|中层（共26层）|南向|2018年建|朱光,爱情缤纷里张家窝-爱情缤纷里,17586元/O,130万
城市,标题,房源信息描述,房源位置信息,单价,房总款
天津,精装私产过五年 诚意出售 交通便利 视野好,2室1厅|79.86O|高层（共22层）|南北向|2017年建|马伟丛,龙都花园挂甲寺-河西区大沽南路与利民道交口东北侧,31930元/O,255万
天津,精装修 一楼地暖 拎包入住,2室1厅|68O|低层（共6层）|南北向|2018年建|沈广升,佳音里万兴街-万峰路与双峰道交口西南角,30000元/O,204万
天津,名都公寓 大两室 房主诚心出售 价位可议 黄金楼层,2室1厅|104.95O|中层（共6层）|南北向|2006年建|张丽娜,名都公寓瑞江-解放南路442号,26679元/O,280万
天津,河北区环内金钟河板块 地铁房 新房项目 9年一贯制小外,3室2厅|95O|低层（共15层）|南北向|2006年建|王子士,中交雅郡城东春晓大毕庄-地铁6号线金钟街地铁站旁,13052元/O,124万
天津,"电梯房,房龄新,中高楼层采光好,中芯有座 。",2室1厅|86.86O|中层（共30层）|南向|2017年建|张静,金德园南营门-贵阳路79号,74833元/O,650万
天津,【拥+金+①%】近海河!湘江道!户型方正!带电梯,2室2厅|111.89O|顶层（共11层）|南北向|2017年建|王洪玉,龙海公寓下瓦房-琼州道11号,35660元/O,399万
天津,万科东第 87平2居 南向精装修 自住保养好,2室2厅|87O|中层（共33层）|南向|2020年建|陈红,万科东第李七庄-卫津南路西侧中医一附院(南院)旁,24022元/O,209万
天津,瑞府+满二无大税+四室精装未住过人+楼层高视野好,4室2厅|169.74O|低层（共15层）|南向|2017年建|汤静静,城投华润天津瑞府梅江-洞庭路与太湖路交口,40061元/O,680万
天津,南北通透万科水晶城依云园3室2厅,3室2厅|164O|底层（共4层）|南北向|2006年建|秦永付,万科水晶城依云园梅江-解放南路518号,35365元/O,580万
天津,资源 三室阳面户型 中间楼层无遮挡采光好 私产钥匙随时看,3室2厅|174O|高层（共10层）|南北向|2018年建|李鑫磊,北大资源阅城陈塘庄-黑牛城道三诚里6号楼,35057元/O,610万
天津,洛卡小镇林溪园 90.29平2居 南北向精装修 安静不临街,2室1厅|90.29O|底层（共5层）|南北向|2008年建|陈红,洛卡小镇林溪园大寺-友谊南路与外环线交口以南200米处,27688元/O,250万
天津,全运村雀榕园全阳三室次新房制绿城物业急,3室2厅|98.87O|高层（共23层）|南北向|2015年建|张丽娜,天津全运村东海街-洞庭路与渌水道交口,39334元/O,388.9万
天津,南营门 西康路地铁站 门脸 私产过两年 看房提前沟通,2室1厅|55.26O|底层（共6层）|南向|2017年建|张寰,信华南里南营门-和平区鞍山道与新疆路交口,61165元/O,338万
天津,"中芥1% 玉皇里 企业产 采光好无遮挡 95年小区,环境整洁",2室1厅|38.95O|中层（共6层）|南向|2017年建|何香,玉皇里万兴街-南开区玉泉路与鞍山西道交口北侧,43132元/O,168万
天津,南开中心小W 临近地铁站 房型好 诚意出售,1室1厅|38.1O|高层（共7层）|东向|1990年建|术勇强,德邻里兴南街-南开三纬路与南开二马路交口西侧,31496元/O,120万
